team_name,member_name,task_id,task_title,task_type,priority,status,created_at,closed_at,last_updated,source_tool,cycle_time
Frontend Foxes,Benjamin Young,BUG-1097,Resolve CSS preflight mismatch,bug,medium,open,2025-01-09 09:30,,2025-01-09 09:30,Jira,
Alpha Squad,Grace Kim,FEAT-230,Integrate real-time collaboration in editor,feature,high,open,2025-01-04 21:10,,2025-01-04 21:10,GitHub,
Beta Builders,William Chen,IMPR-512,Reduce build time with incremental compilation,improvement,medium,open,2025-01-07 14:05,,2025-01-07 14:05,Asana,
Data Ninjas,Sophia Martinez,FEAT-235,Enable data export via API v2,feature,high,open,2025-01-03 10:25,,2025-01-03 10:25,GitHub,
Alpha Squad,Alexandra Reed,BUG-1024,Resolve login timeout error on mobile,bug,high,in_progress,2025-01-03 09:15,,2025-01-05 14:22,GitHub,40.25
Beta Builders,Daniela Kim,FEAT-208,Add dark mode toggle to settings,feature,medium,open,2025-01-04 11:40,,2025-01-04 11:40,Jira,
Data Ninjas,Priya Singh,IMP-457,Improve data export performance,improvement,low,in_progress,2025-01-05 08:30,,2025-01-05 12:10,Asana,
Cloud Warriors,Miguel Santos,FEAT-209,Integrate real-time analytics dashboard,feature,high,open,2025-01-02 16:05,,2025-01-02 16:05,GitHub,
DevOps Dragons,Emma Chen,BUG-1030,Fix intermittent CI build failures,bug,high,in_progress,2025-01-03 22:15,,2025-01-05 09:40,Jira,38.5
Frontend Foxes,Liam Patel,FEAT-210,Implement responsive grid for dashboard,feature,medium,open,2025-01-03 10:25,,2025-01-03 10:25,Trello,
Alpha Squad,Sofia Martinez,IMP-458,Refactor auth module for better testability,improvement,low,open,2025-01-05 13:45,,2025-01-05 13:45,Asana,
Beta Builders,Jonathan Lee,BUG-1031,Address race condition in session handling,bug,high,in_progress,2025-01-04 09:20,,2025-01-04 17:55,GitHub,36.0
Data Ninjas,Alicia Park,FEAT-211,Add multi-language support,feature,medium,open,2025-01-02 14:05,,2025-01-02 14:05,Jira,
Cloud Warriors,Chris Wilson,IMP-459,Cache optimization for API endpoints,improvement,low,open,2025-01-03 07:50,,2025-01-03 07:50,Asana,
DevOps Dragons,Fatima Noor,FEAT-212,Migrate notification service to Kafka,feature,high,open,2025-01-04 18:10,,2025-01-04 18:10,GitHub,
Frontend Foxes,Noah Kim,BUG-1032,CSS layout shift on mobile sizes,bug,medium,in_progress,2025-01-02 21:40,,2025-01-05 08:22,Jira,32.0
Alpha Squad,Hannah Brooks,FEAT-213,Offline mode support for core app,feature,high,open,2025-01-05 06:15,,2025-01-05 06:15,Trello,
Beta Builders,Oliver Chen,IMP-460,Improve logging granularity,improvement,medium,open,2025-01-01 12:00,,2025-01-01 12:00,Asana,
Data Ninjas,Mira Kapoor,BUG-1033,Memory leak in data ingestion pipeline,bug,high,in_progress,2025-01-04 02:20,,2025-01-04 11:30,GitHub,40.75
Cloud Warriors,Daniel Garcia,FEAT-214,User role-based access control,feature,medium,open,2025-01-02 08:50,,2025-01-02 08:50,Jira,
DevOps Dragons,Grace Kim,BUG-1034,Fix flaky tests in CI suite,bug,low,closed,2025-01-01 15:10,2025-01-02 09:40,2025-01-02 09:40,GitHub,26.5
Frontend Foxes,Ethan Park,IMP-461,Improve accessibility labels,improvement,low,open,2025-01-03 19:25,,2025-01-03 19:25,Trello,
Alpha Squad,Grace Lee,BUG-1035,Session timeout not working on iOS,bug,high,in_progress,2025-01-04 23:05,,2025-01-05 07:30,GitHub,40.5
Beta Builders,Daniela Ruiz,FEAT-215,Dashboard widgets re-layout for analytics,feature,medium,open,2025-01-02 13:00,,2025-01-02 13:00,Jira,
Data Ninjas,Mei Chen,IMP-462,CI pipeline caching to reduce build time,improvement,low,open,2025-01-05 09:50,,2025-01-05 09:50,Asana,
Alpha Squad,Alex Carter,BUG-1023,Resolve nil pointer in user session handling,bug,high,closed,2025-01-02 09:15,2025-01-02 11:40,2025-01-02 11:45,Jira,2.42
Beta Builders,Priya Singh,FEAT-207,Implement dark mode for settings page,feature,medium,in_progress,2025-01-03 14:20,,2025-01-06 10:10,GitHub,
Data Ninjas,Miguel Ramirez,IMPR-412,Improve indexing strategy for user analytics,improvement,low,open,2025-01-04 09:50,,2025-01-04 09:50,Asana,
Cloud Warriors,Sophie Chen,FEAT-209,Add export to CSV for project dashboards,feature,high,closed,2025-01-05 08:05,2025-01-05 12:30,2025-01-05 12:32,Jira,4.42
DevOps Dragons,Rahul Kapoor,BUG-1034,Fix intermittent outage in auth service,bug,high,closed,2025-01-05 10:20,2025-01-05 13:00,2025-01-05 13:02,GitHub,2.67
Frontend Foxes,Emily Nguyen,IMPR-421,Refresh component library CSS to reduce bundle size,improvement,medium,open,2025-01-06 16:40,,2025-01-06 16:40,Trello,
Alpha Squad,Jordan Lee,FEAT-210,Create user profile customization options,feature,low,open,2025-01-07 09:25,,2025-01-07 09:25,Asana,
Beta Builders,Nina Patel,BUG-1035,Patch memory leak in background workers,bug,high,in_progress,2025-01-07 11:10,,2025-01-07 15:40,GitHub,
Data Ninjas,Carlos Mendes,FEAT-211,Integrate push notifications for mobile app,feature,high,open,2025-01-08 07:50,,2025-01-08 07:50,Jira,
Cloud Warriors,Aisha Khan,IMPR-423,Audit API response times and add caching,improvement,medium,closed,2025-01-04 13:15,2025-01-04 17:05,2025-01-04 17:07,GitHub,3.83
DevOps Dragons,Victor Chen,FEAT-212,Introduce multi-language support,feature,medium,open,2025-01-09 09:40,,2025-01-09 09:40,Jira,
Frontend Foxes,Olivia Romero,BUG-1036,Fix UI overlap on mobile breakpoints,bug,low,open,2025-01-09 12:05,,2025-01-09 12:05,Trello,
Alpha Squad,Marcus Liu,IMPR-424,Refactor auth middleware for cleaner routes,improvement,low,in_progress,2025-01-10 08:25,,2025-01-11 09:10,Asana,
Beta Builders,Grace Kim,FEAT-213,Dashboard widgets drag-and-drop,feature,medium,open,2025-01-11 14:00,,2025-01-11 14:00,GitHub,
Data Ninjas,Hiro Tanaka,BUG-1037,Null check for user profile picture URL,bug,high,closed,2025-01-12 09:15,2025-01-12 10:05,2025-01-12 10:07,Jira,0.83
Cloud Warriors,Mia Rodriguez,IMPR-426,Improve error handling in payment flow,improvement,medium,open,2025-01-12 15:40,,2025-01-12 15:40,Asana,
DevOps Dragons,Jon Park,BUG-1038,Resolve flaky tests in CI pipeline,bug,high,in_progress,2025-01-13 10:50,,2025-01-13 14:20,GitHub,
Frontend Foxes,Grace Lee,FEAT-214,Add accessibility improvements to forms,feature,low,open,2025-01-13 12:30,,2025-01-13 12:30,Trello,
Alpha Squad,Daniel Kim,BUG-1039,Handle token refresh edge cases,bug,medium,open,2025-01-14 09:05,,2025-01-14 09:05,Jira,
Beta Builders,Isabella Rossi,IMPR-427,Optimize image loading pipeline,improvement,low,open,2025-01-14 11:20,,2025-01-14 11:20,GitHub,
Data Ninjas,Yuki Nakamura,FEAT-215,Add offline mode for data synchronization,feature,high,open,2025-01-15 08:40,,2025-01-15 08:40,Jira,
Alpha Squad,Lina Moreno,BUG-1023,Fix login timeout on slow network,bug,high,in_progress,2025-01-02 09:14,,2025-01-04 16:22,Jira,36.0
Beta Builders,Rajiv Kapoor,FEAT-208,Implement dark mode across dashboards,feature,medium,open,2025-01-03 11:20,,2025-01-03 11:20,GitHub,
Data Ninjas,Mei Chen,IMPR-456,Improve API caching strategy,improvement,low,in_progress,2025-01-04 08:05,,2025-01-04 12:47,Jira,
Cloud Warriors,Jon Park,FEAT-309,Add export to CSV for analytics module,feature,high,open,2025-01-02 14:50,,2025-01-02 14:50,Asana,
DevOps Dragons,Ava Singh,BUG-512,Resolve flaky CI pipeline in staging,bug,high,in_progress,2025-01-02 17:30,,2025-01-05 09:12,GitHub,40.5
Frontend Foxes,Daniel Kim,IMPR-701,Improve Lighthouse scores by lazy loading,improvement,medium,open,2025-01-05 10:02,,2025-01-05 10:02,Jira,
Alpha Squad,Sophie Nguyen,FEAT-410,Add multi-tenant support in user service,feature,high,open,2025-01-01 09:45,,2025-01-03 18:22,Trello,
Beta Builders,Miguel Santos,BUG-614,Fix 404 on project attachments,bug,medium,closed,2025-01-01 15:20,2025-01-02 10:45,2025-01-02 10:45,GitHub,30.25
Data Ninjas,Aria Patel,FEAT-221,Real-time data syncing for dashboards,feature,high,in_progress,2025-01-03 07:30,,2025-01-04 09:40,Jira,
Cloud Warriors,Oliver Chen,IMPR-889,Refactor auth middleware for clarity,improvement,low,open,2025-01-04 13:15,,2025-01-04 13:15,Asana,
DevOps Dragons,Priya Nair,FEAT-512,Enable webhooks for deployment events,feature,medium,open,2025-01-02 22:10,,2025-01-02 22:10,GitHub,
Frontend Foxes,Kai Nakamura,BUG-735,Resolve CSS grid layout gaps,bug,low,in_progress,2025-01-03 12:40,,2025-01-04 08:50,Jira,36.2
Alpha Squad,Amira Ali,IMPR-902,Improve error handling across services,improvement,medium,open,2025-01-03 16:05,,2025-01-03 16:05,Asana,
Beta Builders,Jonah Lee,FEAT-311,Mobile responsiveness fixes,feature,low,open,2025-01-04 09:20,,2025-01-04 09:20,Trello,
Data Ninjas,Sana Rahman,BUG-427,Investigate memory leak in data collector,bug,high,in_progress,2025-01-02 08:40,,2025-01-05 11:03,GitHub,
Cloud Warriors,Ethan Kim,IMPR-603,Optimize image processing pipeline,improvement,medium,open,2025-01-01 20:15,,2025-01-01 20:15,Jira,
DevOps Dragons,Fatima Hassan,FEAT-719,Audit and migrate secrets manager,feature,high,in_progress,2025-01-02 06:50,,2025-01-04 14:05,GitHub,
Frontend Foxes,Lucas Martins,BUG-888,Fix flaky UI tests in CI,bug,high,open,2025-01-04 07:55,,2025-01-04 07:55,Jira,
Alpha Squad,Zoe Carter,FEAT-404,Add second-factor auth flow,feature,medium,open,2025-01-01 10:30,,2025-01-01 10:30,Asana,
Beta Builders,Chen Wei,IMPR-777,Archive old endpoint logs,improvement,low,open,2025-01-03 19:40,,2025-01-03 19:40,GitHub,
Data Ninjas,Nikhil Sharma,BUG-999,Patch security vulnerability in auth,bug,high,open,2025-01-04 12:18,,2025-01-04 12:18,Jira,
Cloud Warriors,Mia Rodriguez,FEAT-221,Add dashboard widget for KPIs,feature,low,open,2025-01-05 09:20,,2025-01-05 09:20,Trello,
Alpha Squad,Jordan Lee,BUG-1023,Fix login error on mobile when biometric fails,bug,high,in_progress,2025-01-03 09:15,,2025-01-07 14:40,Jira,56.0
Beta Builders,Priya Sharma,FEAT-208,Add dark mode and color theme customization,feature,medium,open,2025-01-04 11:30,,2025-01-04 11:30,GitHub,
Data Ninjas,Carlos Mendoza,IMP-456,Improve caching strategy for API responses,improvement,low,open,2025-01-05 08:45,,2025-01-05 08:45,Asana,
Cloud Warriors,Amina Hassan,FEAT-412,Introduce micro-frontend architecture for dashboard,feature,high,in_progress,2025-01-02 16:20,,2025-01-07 09:10,Jira,
DevOps Dragons,Noah Kim,BUG-878,Resolve flaky CI build on commit,bug,high,open,2025-01-06 13:05,,2025-01-06 13:05,GitHub,
Frontend Foxes,Maya Chen,FEAT-999,Implement real-time form validation UX,feature,medium,open,2025-01-03 10:50,,2025-01-04 18:22,Trello,
Alpha Squad,Liam Patel,IMPR-101,Refine error handling across services,improvement,low,closed,2025-01-01 09:20,2025-01-02 17:45,2025-01-02 17:45,Jira,30.0
Beta Builders,Sophia Rossi,FEAT-301,Add multi-language support for UI,feature,high,in_progress,2025-01-05 14:10,,2025-01-07 12:05,GitHub,
Data Ninjas,Raoul Singh,BUG-654,Fix data race in analytics module,bug,high,open,2025-01-04 09:40,,2025-01-07 08:30,Asana,
Cloud Warriors,Elena Novak,IMPR-77,Improve deployment rollback procedure,improvement,medium,open,2025-01-02 07:25,,2025-01-05 15:55,Jira,
DevOps Dragons,Victor Chen,FEAT-210,Offline data sync for mobile clients,feature,low,open,2025-01-06 08:00,,2025-01-06 08:00,GitHub,
Frontend Foxes,Isabella Rossi,BUG-433,Fix tooltip misalignment on dashboard,bug,medium,in_progress,2025-01-03 12:40,,2025-01-07 10:20,Trello,
Alpha Squad,Ethan Park,FEAT-512,Add export to CSV for reports,feature,low,open,2025-01-04 15:25,,2025-01-04 15:25,Asana,
Beta Builders,Hannah Lee,IMPR-88,Optimize image loading pipeline,improvement,medium,open,2025-01-05 09:15,,2025-01-05 09:15,GitHub,
Data Ninjas,Jin Park,BUG-777,Fix null pointer in user service,bug,high,in_progress,2025-01-06 11:30,,2025-01-07 07:45,Jira,
Cloud Warriors,Sophie Liu,FEAT-663,Dashboard widgets customization,feature,medium,open,2025-01-02 09:00,,2025-01-07 09:55,GitHub,
DevOps Dragons,Alex Kim,IMPR-34,Improve log aggregation and search,improvement,low,open,2025-01-03 08:15,,2025-01-03 08:15,Asana,
Frontend Foxes,Grace Park,FEAT-777,Real-time collaboration on documents,feature,high,open,2025-01-04 16:40,,2025-01-04 16:40,GitHub,
Alpha Squad,Olivia Chen,BUG-210,Session timeout handling on active devices,bug,medium,open,2025-01-05 17:05,,2025-01-05 17:05,Jira,
Beta Builders,Daniel Kim,FEAT-310,Accessibility improvements for product pages,feature,low,open,2025-01-06 10:25,,2025-01-06 10:25,Trello,
Data Ninjas,Ana Ruiz,IMPR-66,Refactor ORM layer for better testability,improvement,low,open,2025-01-02 14:30,,2025-01-02 14:30,GitHub,
Cloud Warriors,Miguel Santos,BUG-909,Cache invalidation bug in CDN edge,bug,high,open,2025-01-07 07:20,,2025-01-07 07:20,Jira,
Alpha Squad,Jordan Lee,BUG-1012,Fix null pointer in user profile fetch,bug,high,in_progress,2025-01-02 10:15,,2025-01-04 16:40,Jira,46.5
Beta Builders,Priya Kapoor,FEAT-208,Add dark mode to dashboard UI,feature,medium,open,2025-01-03 09:30,,2025-01-03 09:30,GitHub,
Data Ninjas,Miguel Santos,IMPR-452,Improve data caching for analytics queries,improvement,low,closed,2025-01-01 11:20,2025-01-02 14:45,2025-01-02 14:45,Asana,27.42
Cloud Warriors,Aiko Tanaka,FEAT-214,Integrate live collaboration in editor,feature,high,in_progress,2025-01-04 08:50,,2025-01-04 12:10,Jira,
DevOps Dragons,Jonah Smith,BUG-1033,Resolve deployment failure in staging,bug,high,open,2025-01-05 13:05,,2025-01-05 13:05,GitHub,
Frontend Foxes,Ella Brown,IMPR-801,Refactor CSS for responsive grid,improvement,medium,closed,2025-01-02 15:40,2025-01-03 09:55,2025-01-03 09:55,Trello,24.25
Alpha Squad,Carlos Diaz,FEAT-221,Add export to CSV in reports,feature,low,open,2025-01-04 09:20,,2025-01-04 09:20,Asana,
Beta Builders,Sofia Rossi,BUG-1042,Fix flaky tests in CI pipeline,bug,high,in_progress,2025-01-01 17:10,,2025-01-04 11:30,GitHub,
Data Ninjas,Kai Nakamura,FEAT-226,Enable real-time data streaming,feature,high,open,2025-01-03 12:05,,2025-01-03 12:05,Jira,
Cloud Warriors,Lena Fischer,IMPR-503,Optimize image processing pipeline,improvement,medium,closed,2025-01-02 08:15,2025-01-03 10:40,2025-01-03 10:40,GitHub,26.42
DevOps Dragons,Arun Patel,FEAT-230,Implement multi-env deployment harness,feature,high,open,2025-01-05 07:45,,2025-01-05 07:45,Jira,
Frontend Foxes,Mina Chen,BUG-1051,Fix alignment issues in mobile nav,bug,medium,in_progress,2025-01-04 14:30,,2025-01-04 18:20,Trello,
Alpha Squad,Grace Kim,IMPR-459,Reduce bundle size through code-splitting,improvement,low,open,2025-01-03 10:05,,2025-01-03 10:05,Asana,
Beta Builders,Daniel Rossi,FEAT-212,Add offline support for critical flows,feature,high,closed,2025-01-01 09:40,2025-01-02 12:20,2025-01-02 12:20,GitHub,26.67
Data Ninjas,Riya Kapoor,BUG-1059,Patch security vulnerability in auth,bug,high,open,2025-01-04 16:00,,2025-01-04 16:00,Jira,
Cloud Warriors,Omar Farouk,IMPR-512,Improve logging granularity,improvement,low,open,2025-01-02 19:25,,2025-01-02 19:25,Trello,
DevOps Dragons,Yuki Nakamura,BUG-1067,Fix memory leak in service layer,bug,high,closed,2025-01-01 13:50,2025-01-02 08:40,2025-01-02 08:40,GitHub,23.83
Frontend Foxes,Alex Nguyen,FEAT-241,Add accessibility improvements,feature,medium,open,2025-01-05 10:15,,2025-01-05 10:15,Asana,
Alpha Squad,Nora Ahmed,BUG-1075,Fix authentication timeout,bug,high,in_progress,2025-01-02 07:40,,2025-01-04 15:00,Jira,
Beta Builders,Hiro Tanaka,IMPR-612,Audit test coverage and add missing tests,improvement,medium,open,2025-01-03 18:25,,2025-01-03 18:25,GitHub,
Data Ninjas,Amara Patel,FEAT-260,New data visualization dashboard,feature,low,open,2025-01-04 09:55,,2025-01-04 09:55,Trello,
Alpha Squad,Alexandra Rivera,BUG-1023,Fix login error on Safari causing 500,bug,high,closed,2025-01-02 09:15,2025-01-02 11:30,2025-01-02 11:30,GitHub,2.25
Beta Builders,Daniel Kim,FEAT-208,Add two-factor authentication support,feature,high,closed,2025-01-03 14:20,2025-01-04 10:05,2025-01-04 10:05,Jira,19.75
Data Ninjas,Priya Sharma,IMPR-456,Improve data export format for CSV,improvement,medium,closed,2025-01-05 08:55,2025-01-05 12:40,2025-01-05 12:40,Asana,3.75
Cloud Warriors,Jonah Patel,FEAT-209,Implement dark mode UI theme,feature,medium,open,2025-01-06 10:10,,2025-01-06 10:10,GitHub,
DevOps Dragons,Marta Rossi,BUG-1024,Resolve deployment failure in staging,bug,high,closed,2025-01-02 17:40,2025-01-02 20:15,2025-01-02 20:15,Jira,2.58
Frontend Foxes,Lucas Meyer,IMPR-457,Refactor CSS for responsive grid,improvement,low,open,2025-01-07 09:25,,2025-01-07 09:25,Trello,
Alpha Squad,Sofia Nguyen,FEAT-210,Create user profile API endpoints,feature,high,in_progress,2025-01-08 11:05,,2025-01-09 09:40,GitHub,
Beta Builders,Ethan Brown,BUG-1025,Fix race condition in cache invalidation,bug,high,open,2025-01-04 13:50,,2025-01-04 13:50,Jira,
Data Ninjas,Alicia Kim,FEAT-211,Real-time analytics dashboard widgets,feature,high,closed,2025-01-01 09:00,2025-01-02 16:10,2025-01-02 16:10,Asana,31.17
Cloud Warriors,Mateo Alvarez,IMPR-458,Improve logging granularity,improvement,medium,open,2025-01-09 08:40,,2025-01-09 08:40,Jira,
DevOps Dragons,Chloe Garcia,FEAT-212,Add API rate limiting,feature,high,in_progress,2025-01-03 12:15,,2025-01-10 14:20,GitHub,
Frontend Foxes,Noah Wilson,BUG-1026,Fix alignment bug in header,bug,low,open,2025-01-05 10:00,,2025-01-05 10:00,Trello,
Alpha Squad,Isabella Rossi,IMPR-459,Accessibility audit for forms,improvement,medium,closed,2025-01-02 08:20,2025-01-02 14:45,2025-01-02 14:45,Asana,6.42
Beta Builders,Victor Chan,FEAT-213,Offline mode for mobile app,feature,medium,open,2025-01-08 15:30,,2025-01-08 15:30,GitHub,
Data Ninjas,Grace Lee,BUG-1027,Data migration script failing on prod,bug,high,closed,2025-01-03 07:45,2025-01-03 09:50,2025-01-03 09:50,Jira,0.42
Cloud Warriors,Ravi Singh,IMPR-460,Optimize image processing pipeline,improvement,low,open,2025-01-10 09:10,,2025-01-10 09:10,Asana,
DevOps Dragons,Emily Carter,FEAT-214,Integrate feature flags,feature,medium,in_progress,2025-01-06 13:00,,2025-01-10 08:50,GitHub,
Frontend Foxes,Daniela Ruiz,BUG-1028,Responsive nav menu on mobile,bug,high,open,2025-01-07 17:25,,2025-01-07 17:25,Trello,
Alpha Squad,Michael Chen,FEAT-215,Multilingual support,feature,low,open,2025-01-11 10:50,,2025-01-11 10:50,Jira,
Beta Builders,Yuki Tanaka,IMPR-461,Improve error messages in API,improvement,medium,closed,2025-01-04 09:15,2025-01-04 11:05,2025-01-04 11:05,GitHub,1.83
Data Ninjas,Omar Farouk,BUG-1029,Session timeout not respected,bug,high,open,2025-01-09 12:00,,2025-01-09 12:00,Asana,
Cloud Warriors,Fatima Noor,FEAT-216,Cloud sync improvements,feature,medium,in_progress,2025-01-02 21:30,,2025-01-10 18:00,Jira,
Alpha Squad,Lena Hart,FEAT-208,Implement dark mode toggle across admin panel,feature,medium,in_progress,2025-01-02 09:15,,2025-01-07 14:22,Jira,
Beta Builders,Jon Park,BUG-1015,Fix crash when exporting large CSVs,bug,high,open,2025-01-03 11:40,,2025-01-03 11:40,GitHub,
Data Ninjas,Mei Chen,IMPR-404,Improve caching for user profiles to reduce DB load,improvement,low,open,2025-01-04 08:25,,2025-01-04 08:25,Asana,
Cloud Warriors,Ravi Kumar,FEAT-210,Add multi-region deployment support,feature,high,in_progress,2025-01-04 10:50,,2025-01-06 16:05,Jira,
DevOps Dragons,Aisha Bello,BUG-1016,Resolve DNS intermittent failures in staging,bug,medium,open,2025-01-05 13:20,,2025-01-05 13:20,GitHub,
Frontend Foxes,Carlos Mendes,FEAT-211,Create user profile page with reusable components,feature,high,in_progress,2025-01-05 15:05,,2025-01-07 09:40,GitHub,
Alpha Squad,Nina Solano,IMPR-405,Refactor API error handling to standardize responses,improvement,low,open,2025-01-03 09:50,,2025-01-03 09:50,Trello,
Beta Builders,Omar Singh,FEAT-212,Introduce email notification for task assignments,feature,medium,open,2025-01-02 16:20,,2025-01-02 16:20,Jira,
Data Ninjas,Ava Patel,BUG-1017,Fix memory leak in background workers,bug,high,in_progress,2025-01-06 10:40,,2025-01-06 15:22,GitHub,
Cloud Warriors,Kenji Watanabe,IMPR-406,Improve log aggregation and retention policy,improvement,low,open,2025-01-06 09:10,,2025-01-06 09:10,Asana,
DevOps Dragons,Sophia Rossi,FEAT-213,Add feature flags for beta release,feature,medium,open,2025-01-07 12:30,,2025-01-07 12:30,GitHub,
Frontend Foxes,Diego Alvarez,BUG-1018,Fix alignment issues on dashboard cards,bug,low,open,2025-01-07 14:05,,2025-01-07 14:05,Trello,
Alpha Squad,Priya Kapoor,FEAT-214,Dark mode with accessibility improvements,feature,high,in_progress,2025-01-08 09:25,,2025-01-08 11:00,Jira,
Beta Builders,Liam Chen,IMPR-407,Optimize build pipeline for faster CI,improvement,medium,open,2025-01-03 13:45,,2025-01-03 13:45,GitHub,
Data Ninjas,Hannah Kim,BUG-1019,Address data race in UTC scheduler,bug,high,open,2025-01-04 18:15,,2025-01-04 18:15,Asana,
Cloud Warriors,Jon Park,FEAT-215,Support for webhooks in integration module,feature,medium,open,2025-01-05 08:40,,2025-01-05 08:40,GitHub,
DevOps Dragons,Mina Kowalski,BUG-1020,Fix flaky tests in CI suite,bug,high,in_progress,2025-01-05 17:55,,2025-01-07 08:50,Jira,
Frontend Foxes,Kai Nakamura,IMPR-408,Improve responsive typography system,improvement,low,open,2025-01-06 07:20,,2025-01-06 07:20,Asana,
Alpha Squad,Sophie Martin,BUG-1021,Null pointer safeguard in payment module,bug,high,open,2025-01-04 12:00,,2025-01-04 12:00,GitHub,
Beta Builders,Jon Park,FEAT-216,Mobile app skeleton for offline mode,feature,medium,open,2025-01-07 09:10,,2025-01-07 09:10,Jira,
Data Ninjas,Olivia Rossi,IMPR-409,Standardize unit tests naming conventions,improvement,low,open,2025-01-07 16:40,,2025-01-07 16:40,Asana,
Cloud Warriors,Aria Chen,BUG-1022,Resolve intermittent 500s in payments API,bug,high,open,2025-01-08 10:15,,2025-01-08 10:15,GitHub,
DevOps Dragons,Daniel Kim,IMPR-410,Audit log privacy improvements,improvement,medium,open,2025-01-08 12:30,,2025-01-08 12:30,Jira,
Alpha Squad,Alex Carter,BUG-1023,Fix null pointer when loading user profile,bug,high,open,2025-01-03 09:12,,2025-01-03 09:12,GitHub,
Beta Builders,Priya Sharma,FEAT-208,Add dark mode toggle in settings,feature,medium,in_progress,2025-01-04 14:07,,2025-01-07 16:30,Jira,
Data Ninjas,Liam Chen,IMPRO-452,Improve caching strategy for product feed,improvement,low,open,2025-01-05 11:45,,2025-01-05 11:45,Asana,
Cloud Warriors,Mina Kapoor,FEAT-211,Real-time analytics dashboard widgets,feature,high,in_progress,2025-01-06 09:20,,2025-01-07 10:12,GitHub,
DevOps Dragons,Carlos Mendes,BUG-1045,Resolve intermittent deploy failure on staging,bug,high,open,2025-01-07 08:05,,2025-01-07 08:05,Jira,
Frontend Foxes,Sophie Nguyen,FEAT-209,Responsive grid tweaks for product pages,feature,medium,closed,2025-01-02 13:40,2025-01-04 17:22,2025-01-04 17:22,Trello,54.0
Alpha Squad,Jonah Reed,IMPRO-457,Refactor UI components for accessibility,improvement,medium,in_progress,2025-01-08 10:15,,2025-01-08 10:15,Asana,
Beta Builders,Aisha Khan,BUG-1031,Fix crash on data export,bug,high,open,2025-01-03 16:50,,2025-01-03 16:50,GitHub,
Data Ninjas,Eric Park,FEAT-210,Add multi-tenant support in auth flow,feature,high,in_progress,2025-01-05 09:30,,2025-01-07 12:45,Jira,
Cloud Warriors,Yuki Tanaka,IMPRO-455,Optimize image CDN caching,improvement,low,open,2025-01-02 08:25,,2025-01-02 08:25,GitHub,
DevOps Dragons,Nadia Al-Khaled,FEAT-212,CI/CD pipeline improvements,feature,medium,open,2025-01-04 19:40,,2025-01-04 19:40,Jira,
Frontend Foxes,Daniel Kim,BUG-1040,Fix layout shift on mobile breakpoints,bug,medium,in_progress,2025-01-06 15:22,,2025-01-07 09:55,Trello,
Alpha Squad,Grace Lee,FEAT-213,Offline support for critical reports,feature,high,open,2025-01-07 07:10,,2025-01-07 07:10,GitHub,
Beta Builders,Omar Farouk,IMPRO-456,Improve logging granularity,improvement,low,open,2025-01-05 12:30,,2025-01-05 12:30,Asana,
Data Ninjas,Zoë Becker,BUG-1029,Resolve memory leak in worker pool,bug,high,closed,2025-01-01 10:10,2025-01-03 18:45,2025-01-03 18:45,GitHub,39.92
Cloud Warriors,Ravi Singh,BUG-1041,Patch vulnerable dependency in prod,bug,high,closed,2025-01-03 22:05,2025-01-05 09:30,2025-01-05 09:30,Jira,30.42
DevOps Dragons,Marta Rossi,FEAT-214,Unified notification center,feature,high,in_progress,2025-01-04 08:40,,2025-01-07 14:20,GitHub,
Frontend Foxes,Ella Park,IMPRO-458,Accessibility audits for new pages,improvement,medium,open,2025-01-06 09:50,,2025-01-06 09:50,Asana,
Alpha Squad,Kai Nakamura,BUG-1039,Memory leak in chart module,bug,high,open,2025-01-03 21:15,,2025-01-03 21:15,GitHub,
Beta Builders,Hannah Lee,FEAT-215,Searchable archive with filters,feature,medium,open,2025-01-05 14:40,,2025-01-05 14:40,Jira,
Alpha Squad,Jordan Lee,BUG-1023,Fix null dereference in user session manager,bug,high,in_progress,2025-01-03 09:14,,2025-01-05 11:40,GitHub,
Beta Builders,Priya Kapoor,FEAT-208,Add dark mode theme to settings panel,feature,medium,open,2025-01-04 10:22,,2025-01-04 10:22,Jira,
Data Ninjas,Aarav Singh,IMPR-311,Improve caching layer for API responses,improvement,low,open,2025-01-02 16:45,,2025-01-04 09:30,Trello,
Cloud Warriors,Sofia Martinez,FEAT-209,Integrate real-time analytics dashboard,feature,high,in_progress,2025-01-03 13:05,,2025-01-05 14:02,Asana,
DevOps Dragons,Ethan Chen,BUG-1024,Resolve race condition in deployment pipeline,bug,high,open,2025-01-01 09:50,,2025-01-03 12:20,GitHub,
Frontend Foxes,Mina Patel,FEAT-210,Create component library for UI primitives,feature,medium,in_progress,2025-01-02 11:30,,2025-01-05 08:15,Jira,
Alpha Squad,Jordan Lee,IMPR-312,Refactor authentication module for maintainability,improvement,low,open,2025-01-04 08:45,,2025-01-04 08:45,Trello,
Beta Builders,Priya Kapoor,BUG-1025,Fix typo in onboarding copy,bug,low,closed,2025-01-01 14:20,2025-01-01 15:05,2025-01-01 15:05,Asana,0.75
Data Ninjas,Aarav Singh,FEAT-211,Enable multi-language support for UI,feature,high,open,2025-01-03 17:10,,2025-01-03 17:10,GitHub,
Cloud Warriors,Sofia Martinez,IMPR-313,Archive old logs for compliance,improvement,medium,open,2025-01-05 09:25,,2025-01-05 09:25,Jira,
DevOps Dragons,Liam Johnson,FEAT-212,Add feature flagging framework,feature,high,in_progress,2025-01-02 12:45,,2025-01-04 16:00,Trello,
Frontend Foxes,Mira Kapoor,BUG-1026,Fix responsive layout in dashboard,bug,medium,open,2025-01-04 07:30,,2025-01-04 07:30,Asana,
Alpha Squad,Jordan Lee,FEAT-213,Offline support for core editor,feature,high,open,2025-01-03 19:50,,2025-01-03 19:50,GitHub,
