team_name,member_name,task_id,task_title,task_type,priority,status,created_at,closed_at,last_updated,source_tool,cycle_time
Alpha Squad,Daniel Kim,IMPR-322,Refactor auth middleware for readability,improvement,low,open,2025-01-04 10:20,,2025-01-04 10:20,Trello,
Beta Builders,Emma Wilson,BUG-198,UI glitch on dashboard widgets,bug,medium,in_progress,2025-01-02 13:00,,2025-01-05 09:55,GitHub,60.0
Data Ninjas, Oliver Chen,FEAT-212,Export data as CSV from analytics module,feature,low,open,2025-01-03 15:40,,2025-01-03 15:40,Asana,
Cloud Warriors,Isabella Rossi,IMPR-323,Optimize image loading strategy,improvement,medium,open,2025-01-04 07:50,,2025-01-04 07:50,Jira,
DevOps Dragons,Lucas Brown,FEAT-213,Implement feature flag system,feature,high,in_progress,2025-01-02 18:30,,2025-01-05 08:40,GitHub,
Frontend Foxes,Mia Patel,BUG-199,Responsive layout issues on mobile breakpoints,bug,high,open,2025-01-01 10:00,,2025-01-01 10:00,Trello,
Alpha Squad,Chris Lee,FEAT-214,Analytics dashboard for product metrics,feature,medium,open,2025-01-04 12:35,,2025-01-04 12:35,Asana,
Beta Builders,Arielle Cohen,IMPR-324,Audit logging to improve traceability,improvement,low,open,2025-01-03 06:20,,2025-01-03 06:20,GitHub,
Data Ninjas,Ethan Park,BUG-200,Memory leak in real-time data feed,bug,high,in_progress,2025-01-02 22:10,,2025-01-05 14:35,Jira,
Cloud Warriors,Grace Yu,FEAT-215,Localization support for multiple languages,feature,low,open,2025-01-04 09:05,,2025-01-04 09:05,GitHub,
DevOps Dragons,Ethan Rivera,IMPR-325,Improve deployment rollback safety,improvement,medium,open,2025-01-03 07:40,,2025-01-03 07:40,Trello,
Frontend Foxes,Luna Singh,BUG-201,CSS variable overrides causing theme shift,bug,medium,open,2025-01-02 19:25,,2025-01-02 19:25,GitHub,
Alpha Squad,Olivia Martinez,IMPR-326,Code cleanup in user services,improvement,low,open,2025-01-04 16:50,,2025-01-04 16:50,Jira,
Beta Builders,Daniela Ruiz,FEAT-216,Offline mode for mobile app,feature,high,open,2025-01-03 20:10,,2025-01-03 20:10,Asana,
Data Ninjas,Noah Park,BUG-202,Data race condition in analytics workers,bug,high,in_progress,2025-01-02 08:45,,2025-01-04 18:20,GitHub,
Cloud Warriors,Zoey Kim,IMPR-327,Improve caching strategy,improvement,low,open,2025-01-04 13:05,,2025-01-04 13:05,Jira,
DevOps Dragons,Grace Lee,BUG-203,Resolve flaky tests in CI suite,bug,high,open,2025-01-01 09:40,,2025-01-01 09:40,GitHub,
Frontend Foxes,Chloe Kim,FEAT-217,Real-time collaboration editor,feature,high,open,2025-01-03 12:50,,2025-01-03 12:50,Asana,
Alpha Squad,Aiden Brooks,BUG-204,Session timeout leads to logout in intermittent cases,bug,medium,open,2025-01-02 21:30,,2025-01-02 21:30,Trello,
Alpha Squad,Olivia Chen,BUG-1023,Resolve login timeout after password reset,bug,high,in_progress,2025-01-02 09:14,,2025-01-05 16:22,Jira,54.0
Beta Builders,Marcus Lee,FEAT-208,Add dark mode toggle across settings,feature,medium,open,2025-01-03 11:05,,2025-01-03 11:05,GitHub,
Data Ninjas,Priya Kapoor,IMPR-456,Improve caching for user profiles to reduce latency,improvement,low,closed,2025-01-01 14:20,2025-01-04 09:40,2025-01-04 09:40,Asana,68.0
Cloud Warriors,Daniel Kim,FEAT-209,Integrate payment gateway URL whitelisting,feature,high,in_progress,2025-01-02 08:50,,2025-01-06 10:15,Jira,
DevOps Dragons,Sofia Martinez,BUG-1030,Fix intermittent deploy failure in staging,bug,high,open,2025-01-04 17:22,,2025-01-04 17:22,GitHub,
Frontend Foxes,Ethan Brown,IMPR-457,Refactor CSS for responsive grid system,improvement,medium,closed,2025-01-01 09:40,2025-01-02 12:15,2025-01-02 12:15,Trello,15.0
Alpha Squad,Mia Rodriguez,FEAT-210,Implement multi-language support,feature,high,in_progress,2025-01-03 13:40,,2025-01-05 19:20,Jira,
Beta Builders,Liam Gallagher,BUG-1031,Correct currency formatting in invoices,bug,medium,open,2025-01-02 10:30,,2025-01-02 10:30,GitHub,
Data Ninjas,Aisha Khan,FEAT-211,Upgrade analytics dashboard widgets,feature,low,open,2025-01-04 09:12,,2025-01-04 09:12,Asana,
Cloud Warriors,Jonah Patel,IMPR-458,Optimize image loading pipeline,improvement,low,closed,2025-01-01 12:00,2025-01-03 14:00,2025-01-03 14:00,GitHub,48.0
DevOps Dragons,Grace Liu,FEAT-212,Automate environment provisioning,feature,high,in_progress,2025-01-02 15:25,,2025-01-06 08:40,Jira,
Frontend Foxes,Noah Wilson,BUG-1032,Cross-browser compatibility fixes for Safari,bug,medium,open,2025-01-03 07:50,,2025-01-03 07:50,Trello,
Alpha Squad,Isabella Rossi,IMPR-459,Improve unit test coverage for services layer,improvement,medium,closed,2025-01-01 16:10,2025-01-03 09:25,2025-01-03 09:25,Asana,52.0
Beta Builders,Oliver Smith,FEAT-213,Offline support for reports,feature,low,open,2025-01-04 10:05,,2025-01-04 10:05,GitHub,
Data Ninjas,Riya Singh,BUG-1033,Database connection pool exhaustion fix,bug,high,in_progress,2025-01-04 18:30,,2025-01-06 12:05,Jira,
Cloud Warriors,Carlos Mendes,BUG-1034,DNS resolution slowdown in prod,bug,high,open,2025-01-03 22:40,,2025-01-04 23:10,GitHub,
DevOps Dragons,Ava Johnson,FEAT-214,CI/CD pipeline enhancements,feature,medium,open,2025-01-02 19:00,,2025-01-02 19:00,Jira,
Frontend Foxes,Daniel Garcia,IMPR-460,Improve accessibility attributes across pages,improvement,low,open,2025-01-01 08:15,,2025-01-01 08:15,Trello,
Alpha Squad,Chloe Kim,FEAT-215,Add API for user settings export,feature,high,open,2025-01-04 12:45,,2025-01-04 12:45,GitHub,
Beta Builders,Hector Ruiz,IMPR-461,Data migration cleanup scripts,improvement,low,closed,2025-01-01 13:25,2025-01-02 15:55,2025-01-02 15:55,Asana,28.0
Data Ninjas,Zoey Chen,BUG-1035,Session timeout listener improvements,bug,medium,open,2025-01-03 21:10,,2025-01-03 21:10,Jira,
Alpha Squad,Mina Patel,BUG-1101,Fix null pointer in user preferences update,bug,high,open,2025-01-02 09:14,,2025-01-02 09:14,Jira,
Beta Builders,Jordan Kim,FEAT-208,Add dark mode theme and accessibility tweaks,feature,medium,in_progress,2025-01-03 11:22,,2025-01-05 16:45,GitHub,
Data Ninjas,Ava Rossi,IMPRO-305,Improve caching for analytics queries,improvement,high,in_progress,2025-01-04 08:05,,2025-01-05 09:30,Jira,
Cloud Warriors,Liam Chen,FEAT-212,Integrate payment gateway v2,feature,high,open,2025-01-06 14:40,,2025-01-06 14:40,GitHub,
DevOps Dragons,Sophia Singh,BUG-1112,Fix deployment failure on staging due to env var,bug,high,open,2025-01-07 10:05,,2025-01-07 10:05,Jira,
Frontend Foxes,Daniel Park,IMPRO-189,Update lint rules and CI style checks,improvement,low,closed,2025-01-01 12:20,2025-01-03 09:40,2025-01-03 09:40,Trello,40.0
Alpha Squad,Mina Patel,FEAT-219,Implement multi-language support,feature,medium,in_progress,2025-01-05 16:10,,2025-01-06 08:22,Asana,
Beta Builders,Ethan Park,BUG-1105,Memory leak in image processing module,bug,high,open,2025-01-02 07:45,,2025-01-05 12:15,GitHub,
Data Ninjas,Zoë Kim,FEAT-214,Real-time collaboration cursors,feature,low,open,2025-01-04 13:40,,2025-01-04 13:40,Jira,
Cloud Warriors,Noah Patel,IMPRO-301,Database connection pooling improvements,improvement,medium,closed,2025-01-02 09:00,2025-01-04 17:20,2025-01-04 17:20,GitHub,48.3333333333
DevOps Dragons,Emma Rivera,FEAT-217,Deploy feature flags service,feature,high,in_progress,2025-01-03 18:30,,2025-01-05 09:50,Asana,
Frontend Foxes,Kai Nakamura,BUG-1109,Cross-browser compatibility for dashboard,bug,medium,open,2025-01-04 08:25,,2025-01-05 15:11,Jira,
Alpha Squad,Mina Patel,IMPRO-410,Refactor API client for retries,improvement,low,closed,2025-01-02 10:05,2025-01-04 11:30,2025-01-04 11:30,GitHub,48.5
Beta Builders,Lucas White,FEAT-223,Offline mode and local storage sync,feature,medium,open,2025-01-06 09:55,,2025-01-06 09:55,Asana,
Data Ninjas,Aria Singh,BUG-1110,Crash on data export in edge case,bug,high,open,2025-01-05 07:20,,2025-01-07 14:07,Jira,
Cloud Warriors,Mason Lee,IMPRO-302,Improve observability with tracing,improvement,low,open,2025-01-07 13:40,,2025-01-07 13:40,GitHub,
DevOps Dragons,Isabella Rossi,BUG-1115,Role-based access control bug fix,bug,high,in_progress,2025-01-05 15:00,,2025-01-07 09:21,Jira,
Frontend Foxes,Riya Kapoor,FEAT-226,Responsive grid system overhaul,feature,high,open,2025-01-06 12:00,,2025-01-06 12:00,Trello,
Alpha Squad,Mina Patel,BUG-1117,Session timeout not resetting on logout,bug,medium,open,2025-01-02 16:25,,2025-01-03 08:30,GitHub,
Beta Builders,Ethan Park,IMPRO-312,Static analysis improvements,improvement,low,open,2025-01-03 14:50,,2025-01-04 10:05,Asana,
Data Ninjas,Noah Kim,FEAT-230,Export to CSV with streaming,feature,medium,in_progress,2025-01-04 19:40,,2025-01-06 22:11,GitHub,
Cloud Warriors,Ella Chen,BUG-1118,UI crash when resizing window,bug,high,open,2025-01-05 03:15,,2025-01-05 09:02,Jira,
Alpha Squad,Alex Johnson,BUG-1023,Fix login crash on Safari 14,bug,high,in_progress,2025-01-02 09:15,,2025-01-04 11:40,Jira,32.0
Beta Builders,Priya Natarajan,FEAT-208,Add dark mode toggle,feature,medium,open,2025-01-03 10:20,,2025-01-03 10:20,GitHub,
Data Ninjas,Luis Fernández,IMPR-305,Improve data caching for API responses,improvement,low,open,2025-01-05 14:05,,2025-01-05 14:05,Asana,
Cloud Warriors,Mina Chen,FEAT-211,Set up micro-frontend architecture,feature,high,in_progress,2025-01-04 08:50,,2025-01-06 09:12,Jira,
DevOps Dragons,Omar Rahman,BUG-1067,Resolve CI pipeline intermittent failures,bug,high,open,2025-01-07 12:02,,2025-01-07 12:02,GitHub,
Frontend Foxes,Sophie Kim,IMPR-472,Refactor CSS for responsive typography,improvement,medium,closed,2025-01-02 16:45,2025-01-04 09:30,2025-01-04 09:30,Trello,46.25
Alpha Squad,Daniel Park,FEAT-209,Integrate payment gateway sandbox,feature,high,in_progress,2025-01-06 11:20,,2025-01-06 11:20,GitHub,
Beta Builders,Emily Stone,BUG-1035,Fix email delivery failure in staging,bug,medium,open,2025-01-05 09:40,,2025-01-05 09:40,Jira,
Data Ninjas,Akira Tan,FEAT-210,Export dashboard as PDF,feature,low,open,2025-01-08 13:25,,2025-01-08 13:25,Asana,
Cloud Warriors,Hanna Patel,IMPR-306,Tune database indices for international users,improvement,medium,open,2025-01-03 15:10,,2025-01-03 15:10,Jira,
DevOps Dragons,Jonah Reed,FEAT-213,Publish public API v2 documentation,feature,low,open,2025-01-02 10:05,,2025-01-02 10:05,GitHub,
Frontend Foxes,Grace Liu,BUG-1041,Address flaky UI animation on Safari,bug,high,in_progress,2025-01-04 18:20,,2025-01-05 09:50,Jira,
Alpha Squad,Rafael Costa,IMPR-307,Improve logging granularity,improvement,low,open,2025-01-07 09:30,,2025-01-07 09:30,Asana,
Beta Builders,Kara Chen,FEAT-212,Offline mode for mobile app,feature,medium,open,2025-01-04 07:55,,2025-01-04 07:55,Trello,
Data Ninjas,Miguel Santos,BUG-1038,Fix data export CSV encoding,bug,low,closed,2025-01-01 12:15,2025-01-02 08:40,2025-01-02 08:40,GitHub,28.42
Cloud Warriors,Yuki Nakamura,IMPR-308,Optimize cron job run window,improvement,low,open,2025-01-05 06:50,,2025-01-05 06:50,Asana,
DevOps Dragons,Priya Kapoor,BUG-1045,Fix Docker image size regression,bug,high,open,2025-01-06 14:30,,2025-01-06 14:30,GitHub,
Frontend Foxes,Michael Chen,FEAT-214,Add multi-language support,feature,medium,open,2025-01-07 17:05,,2025-01-07 17:05,Jira,
Alpha Squad,Lina Ahmed,BUG-1049,Fix memory leak in frontend app,bug,high,open,2025-01-08 09:15,,2025-01-08 09:15,GitHub,
Beta Builders,Noah Smith,IMPR-309,Improve CI cache hit rate,improvement,medium,open,2025-01-03 21:40,,2025-01-03 21:40,Asana,
Alpha Squad,Daniel Kim,BUG-1012,Fix crash on login when token expires,bug,high,in_progress,2025-01-02 09:14,,2025-01-04 16:30,Jira,42.5
Beta Builders,Sofia Patel,FEAT-208,Add dark mode toggle and persisted theme,feature,medium,open,2025-01-03 11:20,,2025-01-03 11:20,GitHub,
Data Ninjas,Liam Chen,IMPR-315,Improve logging format across services,improvement,low,in_progress,2025-01-04 08:05,,2025-01-06 10:45,Asana,
Cloud Warriors,Amina Saleh,FEAT-212,Enable multi-tenant support in API layer,feature,high,open,2025-01-02 14:40,,2025-01-02 14:40,Jira,
DevOps Dragons,Marco Rossi,BUG-1029,Resolver memory leak in worker pool,bug,high,closed,2025-01-01 09:00,2025-01-02 18:20,2025-01-02 18:20,GitHub,34.33
Frontend Foxes,Priya Nair,IMPR-402,Refactor CSS for responsive grid,improvement,medium,closed,2025-01-01 12:15,2025-01-02 15:45,2025-01-02 15:45,Trello,54.0
Alpha Squad,Jonah Park,FEAT-209,Integrate payment gateway v2,feature,high,in_progress,2025-01-03 07:50,,2025-01-05 09:10,GitHub,
Beta Builders,Elena Ruiz,BUG-1034,Fix 500 on report export,bug,medium,open,2025-01-04 10:22,,2025-01-04 10:22,Jira,
Data Ninjas,Noah Smith,FEAT-210,Dashboard custom date ranges,feature,low,open,2025-01-02 16:55,,2025-01-02 16:55,Asana,
Cloud Warriors,Yara Hassan,IMPR-318,Optimize Redis caching strategy,improvement,low,in_progress,2025-01-05 09:30,,2025-01-06 12:10,GitHub,
DevOps Dragons,Alex Kim,FEAT-213,Add webhook support for external CI,feature,medium,open,2025-01-03 13:45,,2025-01-03 13:45,Jira,
Frontend Foxes,Grace Chen,BUG-1035,Fix alignment on settings page,bug,low,open,2025-01-04 08:40,,2025-01-04 08:40,Trello,
Alpha Squad,Miguel Santos,IMPR-320,Improve test coverage for user module,improvement,medium,closed,2025-01-01 15:20,2025-01-03 11:05,2025-01-03 11:05,Asana,39.75
Beta Builders,Iris Novak,FEAT-214,Offline mode for mobile clients,feature,high,in_progress,2025-01-02 20:10,,2025-01-04 17:22,GitHub,
Data Ninjas,Owen Lee,BUG-1036,Data integrity check for ETL pipeline,bug,high,open,2025-01-03 09:40,,2025-01-03 09:40,Jira,
Cloud Warriors,Mina Kapoor,IMPR-322,Audit IAM permissions,improvement,medium,open,2025-01-04 14:50,,2025-01-04 14:50,Asana,
DevOps Dragons,Jia Chen,BUG-1037,Race condition in deploy script,bug,high,open,2025-01-05 06:25,,2025-01-05 06:25,GitHub,
Frontend Foxes,Daniela Ruiz,FEAT-215,Accessibility improvements in modal dialogs,feature,medium,open,2025-01-04 12:05,,2025-01-04 12:05,Jira,
Alpha Squad,Kevin Chen,BUG-1038,Error handling for API timeout,bug,high,in_progress,2025-01-02 07:30,,2025-01-04 09:17,GitHub,
Beta Builders,Maya Singh,IMPR-324,Codebase linting and style enforcement,improvement,low,open,2025-01-03 18:45,,2025-01-03 18:45,Asana,
Alpha Squad,Jordan Lee,BUG-1042,Fix null pointer in user profile loading,bug,high,in_progress,2025-01-03 10:15,,2025-01-07 16:40,GitHub,
Beta Builders,Samantha Chen,FEAT-208,Add dark mode toggle across settings,feature,medium,open,2025-01-05 09:50,,2025-01-05 09:50,Jira,
Data Ninjas,Rafael Kim,IMP-412,Improve dashboard data caching for performance,improvement,low,open,2025-01-04 14:20,,2025-01-04 14:20,Asana,
Cloud Warriors,Priya Singh,FEAT-209,Implement export to CSV for analytics panel,feature,high,in_progress,2025-01-06 11:05,,2025-01-07 08:22,GitHub,
DevOps Dragons,Miguel Santos,BUG-1050,Resolve flaky CI runner in nightly pipeline,bug,high,open,2025-01-02 08:40,,2025-01-06 13:10,Jira,
Frontend Foxes,Emily Carter,IMP-301,Revise accessibility labels for forms,improvement,medium,closed,2025-01-01 12:30,2025-01-03 09:15,2025-01-03 09:15,Trello,54.75
Alpha Squad,Daniel Park,FEAT-210,Add real-time notifications for comments,feature,high,in_progress,2025-01-07 09:20,,2025-01-07 09:20,Asana,
Beta Builders,Aisha Khan,BUG-1051,Fix broken hyperlink in help center,bug,low,open,2025-01-08 15:45,,2025-01-08 15:45,GitHub,
Data Ninjas,Liam O'Connor,FEAT-211,Integrate multi-language support,feature,medium,open,2025-01-09 10:10,,2025-01-09 10:10,Jira,
Cloud Warriors,Nina Romero,IMP-413,Standardize error handling framework,improvement,low,open,2025-01-04 16:50,,2025-01-04 16:50,GitHub,
DevOps Dragons,Kai Nakamura,FEAT-212,Enable feature flags for beta releases,feature,medium,open,2025-01-05 18:30,,2025-01-05 18:30,Asana,
Frontend Foxes,Grace Liu,IMP-414,Improve test coverage for auth module,improvement,high,in_progress,2025-01-06 13:15,,2025-01-07 12:05,Trello,
Alpha Squad,Chris Morgan,BUG-1052,Incorrect password reset email link,bug,medium,open,2025-01-08 08:25,,2025-01-08 08:25,GitHub,
Beta Builders,Fatima Noor,FEAT-213,Add webhook integration for GitHub events,feature,low,open,2025-01-09 09:40,,2025-01-09 09:40,Jira,
Data Ninjas,Marco Rossi,IMP-415,Refactor data access layer to use async I/O,improvement,medium,in_progress,2025-01-07 14:05,,2025-01-07 18:20,Asana,
Cloud Warriors,Hitoshi Tanaka,BUG-1053,Memory leak in image processing service,bug,high,open,2025-01-05 11:00,,2025-01-06 10:40,GitHub,
DevOps Dragons,Ana Martinez,FEAT-214,Migrate deployment scripting to YAML,feature,medium,open,2025-01-04 19:25,,2025-01-06 09:10,Jira,
Frontend Foxes,Daniel Kim,IMP-416,Improve caching on product listing,improvement,low,open,2025-01-03 08:50,,2025-01-03 08:50,Trello,
Alpha Squad,Mina Patel,FEAT-215,Add offline mode for mobile app,feature,high,open,2025-01-10 12:20,,2025-01-10 12:20,Asana,
Beta Builders,Jonah Reed,IMP-417,Cleanup deprecated API endpoints,improvement,low,open,2025-01-11 09:15,,2025-01-11 09:15,Jira,
Data Ninjas,Ava Singh,BUG-1054,Memory usage spike during bulk import,bug,high,open,2025-01-12 10:05,,2025-01-12 10:05,GitHub,
Alpha Squad,Olivia Chen,BUG-1023,Fix login error on Safari when cookies are disabled,bug,high,in_progress,2025-01-03 09:14,,2025-01-04 11:27,Jira,0.0
Beta Builders,Raj Patel,FEAT-208,Implement dark mode for user dashboard,feature,medium,open,2025-01-05 10:05,,2025-01-05 10:05,GitHub,
Data Ninjas,Mia Torres,IMPR-456,Improve API response caching to reduce latency,improvement,low,open,2025-01-06 14:22,,2025-01-06 14:22,Asana,
Cloud Warriors,Liam Zhang,FEAT-211,Add multi-tenant support for analytics module,feature,high,in_progress,2025-01-04 08:40,,2025-01-07 09:12,Jira,0.0
DevOps Dragons,Sophia Rossi,BUG-1045,Resolve deployment failure on staging due to missing env vars,bug,high,open,2025-01-02 16:30,,2025-01-07 08:55,GitHub,
Frontend Foxes,Ethan Kim,IMPR-789,Refactor UI components for accessibility improvements,improvement,medium,closed,2025-01-01 09:00,2025-01-02 12:15,2025-01-02 12:15,Trello,27.25
Alpha Squad,Ava Singh,FEAT-213,Add OAuth2 login for enterprise customers,feature,high,open,2025-01-06 11:20,,2025-01-06 11:20,Asana,
Beta Builders,Noah Williams,BUG-1049,Security patch for input validation on signup,bug,medium,in_progress,2025-01-03 13:45,,2025-01-07 10:02,Jira,0.0
Data Ninjas,Chloe Reed,FEAT-214,Integrate payment gateway trial API,feature,low,open,2025-01-05 09:02,,2025-01-05 09:02,GitHub,
Cloud Warriors,Daniel Ruiz,IMPR-457,Optimize database index usage,improvement,low,open,2025-01-07 07:44,,2025-01-07 07:44,Asana,
DevOps Dragons,Grace Lee,FEAT-215,Add real-time notifications via WebSocket,feature,high,in_progress,2025-01-04 18:50,,2025-01-07 09:39,GitHub,0.0
Frontend Foxes,Oliver Chen,BUG-1051,Fix responsive layout break on mobile tablets,bug,high,open,2025-01-04 12:10,,2025-01-04 12:10,Jira,
Alpha Squad,Isabella Perez,IMPR-458,Audit and optimize API request payloads,improvement,medium,closed,2025-01-02 10:15,2025-01-03 15:40,2025-01-03 15:40,GitHub,29.42
Beta Builders,Lucas Martin,FEAT-216,Enable offline mode for mobile apps,feature,low,open,2025-01-05 16:25,,2025-01-05 16:25,Trello,
Data Ninjas,Sofia Kim,BUG-1052,Fix data race in analytics worker,bug,high,in_progress,2025-01-03 19:05,,2025-01-07 12:01,Jira,0.0
Cloud Warriors,Mason Gray,IMPR-459,Improve error messages for API failures,improvement,medium,open,2025-01-06 08:30,,2025-01-06 08:30,Asana,
DevOps Dragons,Emma Zhao,BUG-1053,Resolve flaky tests in CI pipeline,bug,high,in_progress,2025-01-03 21:50,,2025-01-07 11:58,GitHub,0.0
Frontend Foxes,Mason Reed,IMPR-460,Improve webpack build times,improvement,low,open,2025-01-05 08:15,,2025-01-05 08:15,Jira,
Alpha Squad,Grace Chen,BUG-1054,Fix crash on profile edit when offline,bug,high,open,2025-01-06 09:40,,2025-01-06 09:40,GitHub,
Beta Builders,Daniel Kim,IMPR-461,Refine logging to reduce noise,improvement,medium,open,2025-01-07 07:02,,2025-01-07 07:02,Asana,
Data Ninjas,Ella Park,FEAT-217,Add analytics event tracking for onboarding,feature,low,open,2025-01-07 10:30,,2025-01-07 10:30,GitHub,
Alpha Squad,Lena Hart,BUG-1012,Fix login race condition on slow networks,bug,high,in_progress,2025-01-02 09:15,,2025-01-04 14:22,Jira,
Beta Builders,Raj Kapoor,FEAT-208,Add dark mode theme with accessibility colors,feature,medium,open,2025-01-05 11:40,,2025-01-05 11:40,GitHub,
Data Ninjas,Zoë Chen,IMPR-412,Improve logging format for audit trail,improvement,low,open,2025-01-06 08:05,,2025-01-06 08:05,Trello,
Cloud Warriors,Michael O'Neil,FEAT-215,Implement multi-tenant database routing,feature,high,in_progress,2025-01-03 16:20,,2025-01-07 10:11,Asana,
DevOps Dragons,Amina Farouk,BUG-1035,Resolve flaky CI pipeline on commit,bug,high,open,2025-01-04 13:50,,2025-01-04 13:50,Jira,
Frontend Foxes,Diego Martins,IMPR-678,Refactor UI components for consistency,improvement,medium,in_progress,2025-01-02 09:30,,2025-01-07 09:45,GitHub,
Alpha Squad,Sara Kim,FEAT-309,Add user profile page with edit capability,feature,medium,open,2025-01-05 10:12,,2025-01-05 10:12,Jira,
Beta Builders,Jonah Reed,BUG-1041,Fix image rendering on high-DPI screens,bug,low,open,2025-01-03 14:40,,2025-01-03 14:40,GitHub,
Data Ninjas,Nina Kapoor,FEAT-221,Integrate external analytics service,feature,high,in_progress,2025-01-02 17:20,,2025-01-06 18:05,Asana,
Cloud Warriors,Hassan Idris,IMPR-501,Optimize cache eviction policy,improvement,medium,open,2025-01-07 09:05,,2025-01-07 09:05,Trello,
DevOps Dragons,Priya Singh,FEAT-324,Migrate to distributed tracing,feature,high,in_progress,2025-01-04 12:45,,2025-01-07 11:02,GitHub,
Frontend Foxes,Omar Farah,BUG-1056,Fix accessibility issues in modal dialogs,bug,high,open,2025-01-03 09:15,,2025-01-03 09:15,Jira,
Alpha Squad,Mia Rossi,IMPR-722,Improve error messaging UX,improvement,low,open,2025-01-06 15:40,,2025-01-06 15:40,Asana,
Beta Builders,Thomas Lee,FEAT-410,Add offline support for core features,feature,medium,in_progress,2025-01-02 08:50,,2025-01-07 08:58,GitHub,
Data Ninjas,Yara Haddad,BUG-1067,Fix data inconsistency between services,bug,high,open,2025-01-05 19:25,,2025-01-05 19:25,Jira,
Cloud Warriors,Lucas Moreau,IMPR-814,Streamline deployment checks,improvement,low,open,2025-01-01 07:15,,2025-01-01 07:15,Trello,
DevOps Dragons,Ava Chen,BUG-1072,Resolve flaky tests after migration,bug,high,in_progress,2025-01-06 12:00,,2025-01-07 12:00,GitHub,
Frontend Foxes,Kai Nakamura,FEAT-512,Create responsive grid system,feature,medium,open,2025-01-04 10:55,,2025-01-04 10:55,Jira,
Alpha Squad,Grace Liu,FEAT-333,User invitations workflow,feature,high,in_progress,2025-01-02 21:10,,2025-01-07 13:05,Asana,
Beta Builders,Carlos Mendes,IMPR-902,Audit and optimize API response times,improvement,medium,open,2025-01-03 18:25,,2025-01-03 18:25,GitHub,
Data Ninjas,Alex Kim,BUG-1089,Fix stale cache leading to old data,bug,low,open,2025-01-05 07:40,,2025-01-05 07:40,Jira,
Alpha Squad,Jenna Patel,BUG-1023,Resolve login retry bug causing 500 on rare paths,bug,high,closed,2025-01-02 10:15,2025-01-02 12:40,2025-01-02 12:45,Jira,2.42
Beta Builders,Marco Rossi,FEAT-208,Add dark mode theme across settings and dashboards,feature,medium,closed,2025-01-03 09:30,2025-01-04 11:20,2025-01-04 11:20,GitHub,25.83
Data Ninjas,Amina Khan,IMP-457,Improve data caching to reduce API latency,improvement,low,in_progress,2025-01-05 14:05,,2025-01-06 09:10,Asana,
Cloud Warriors,Lucas Silva,BUG-1034,Fix S3 upload failure on large files,bug,high,open,2025-01-07 08:20,,2025-01-07 08:20,Jira,
DevOps Dragons,Priya Nair,FEAT-209,Introduce CI pipeline for multi-branch testing,feature,high,closed,2025-01-02 16:40,2025-01-03 18:55,2025-01-03 18:55,GitHub,26.25
Frontend Foxes,Ethan Chen,IMPR-512,Refactor UI components to reduce bundle size,improvement,medium,open,2025-01-04 11:25,,2025-01-04 11:25,Trello,
Alpha Squad,Mira Singh,FEAT-210,Add export to CSV for user reports,feature,low,in_progress,2025-01-06 09:40,,2025-01-06 12:10,Jira,
Beta Builders,Jonah Kim,BUG-1035,Fix session timeout causing logout during checkout,bug,high,closed,2025-01-02 13:20,2025-01-02 15:05,2025-01-02 15:05,GitHub,1.75
Data Ninjas,Sara Park,FEAT-211,Enable multi-language support,feature,medium,open,2025-01-08 10:15,,2025-01-08 10:15,Asana,
Cloud Warriors,Ibrahim Ali,IMPR-513,Optimize image loading with lazy loading,improvement,low,in_progress,2025-01-05 17:20,,2025-01-05 17:20,Trello,
DevOps Dragons,Chloe Martinez,BUG-1036,Resolve DNS resolution intermittency in test env,bug,medium,open,2025-01-09 08:50,,2025-01-09 08:50,Jira,
Frontend Foxes,Daniel Ruiz,FEAT-212,Implement feature flagging framework,feature,high,closed,2025-01-01 14:05,2025-01-02 09:40,2025-01-02 09:40,GitHub,20.58
Alpha Squad,Keira Patel,IMPR-514,Improve accessibility labels across forms,improvement,medium,open,2025-01-10 11:30,,2025-01-10 11:30,Asana,
Beta Builders,Luis Fernandez,FEAT-213,Add real-time collaboration view,feature,high,in_progress,2025-01-03 12:00,,2025-01-04 09:15,Jira,
Data Ninjas,Nina Patel,BUG-1037,Corrupt data on export to CSV under load,bug,high,open,2025-01-06 08:40,,2025-01-06 08:40,Jira,
Cloud Warriors,Rajiv Menon,IMPR-515,Reduce API error rate with retry logic,improvement,medium,open,2025-01-07 19:10,,2025-01-07 19:10,Asana,
DevOps Dragons,Anya Olsen,FEAT-214,Migrate to new build system,feature,low,open,2025-01-08 09:40,,2025-01-08 09:40,GitHub,
Frontend Foxes,Carlos Diaz,BUG-1038,Fix CSS grid gaps on dashboard,bug,low,closed,2025-01-02 07:15,2025-01-02 08:50,2025-01-02 08:50,Trello,1.58
Alpha Squad,Priya Kapoor,FEAT-215,Add offline support for critical flows,feature,high,in_progress,2025-01-09 10:05,,2025-01-09 10:05,Jira,
Beta Builders,Yuki Tanaka,IMPR-516,Cleanup deprecated endpoints,improvement,low,open,2025-01-04 15:25,,2025-01-04 15:25,Asana,
Data Ninjas,Owen Gray,FEAT-216,Analytics dashboard refresh rates improvements,feature,medium,open,2025-01-10 13:50,,2025-01-10 13:50,GitHub,
Alpha Squad,Alex Carter,BUG-1023,Fix login error on mobile when pushing enter,bug,high,in_progress,2025-01-02 09:15,,2025-01-04 17:40,Jira,72.5
Beta Builders,Priya Singh,FEAT-208,Add dark mode toggle across settings,feature,medium,open,2025-01-03 11:02,,2025-01-03 11:02,GitHub,
Data Ninjas,Mason Lee,IMPRO-457,Improve data fetch cache to reduce API load,improvement,low,closed,2025-01-01 08:00,2025-01-02 14:30,2025-01-02 14:30,Asana,38.5
