team_name,member_name,task_id,task_title,task_type,priority,status,created_at,closed_at,last_updated,source_tool,cycle_time
Alpha Squad,Olivia Chen,BUG-1023,Fix session timeout on dashboard,bug,high,in_progress,2025-01-02 10:15,,2025-01-04 16:40,Jira,28.5
Beta Builders,Raj Patel,FEAT-208,Add analytics tab with funnel visualization,feature,medium,open,2025-01-03 09:00,,2025-01-03 09:00,GitHub,
Data Ninjas,Mia Rodriguez,IMPR-501,Improve database indexing for user lookups,improvement,low,in_progress,2025-01-04 11:20,,2025-01-05 14:05,Asana,
Cloud Warriors,Lukas Becker,FEAT-211,Implement dark mode toggle,feature,low,open,2025-01-05 08:45,,2025-01-05 08:45,Trello,
DevOps Dragons,Sofia Martins,BUG-1045,Resolve flaky CI pipeline on PR builds,bug,high,in_progress,2025-01-02 14:30,,2025-01-06 09:10,Jira,32.6
Frontend Foxes,Daniel Kim,IMPR-872,Refactor CSS for grid gaps,improvement,medium,open,2025-01-04 13:50,,2025-01-04 13:50,GitHub,
Alpha Squad,Priya Nair,FEAT-212,Add user profile avatars,feature,medium,in_progress,2025-01-03 16:10,,2025-01-05 19:25,Asana,
Beta Builders,Arman Singh,BUG-1048,Fix payment gateway error on retries,bug,high,open,2025-01-05 09:20,,2025-01-05 09:20,Jira,
Data Ninjas,Grace Liu,FEAT-213,Real-time data export to CSV,feature,high,in_progress,2025-01-02 18:40,,2025-01-06 12:30,GitHub,
Cloud Warriors,Jonah Reed,IMPR-503,Cache strategy tuning for API responses,improvement,low,open,2025-01-05 07:55,,2025-01-05 07:55,Trello,
DevOps Dragons,Ava Chen,FEAT-214,SSO integration across apps,feature,high,in_progress,2025-01-01 12:05,,2025-01-06 08:45,Asana,
Frontend Foxes,Jonah Patel,BUG-1050,Fix carousel autoplay malfunction,bug,medium,open,2025-01-04 09:15,,2025-01-04 09:15,GitHub,
Alpha Squad,Emily Carter,IMPR-504,Improve error messages across UI,improvement,low,closed,2025-01-01 08:40,2025-01-02 15:20,2025-01-02 15:20,Jira,38.7
Beta Builders,Victor Zhang,FEAT-215,Offline mode support,feature,medium,open,2025-01-03 20:00,,2025-01-03 20:00,Trello,
Data Ninjas,Isabel Garcia,BUG-1052,Data normalization bug in user events,bug,high,in_progress,2025-01-05 11:25,,2025-01-06 07:40,GitHub,28.2
Cloud Warriors,Luis Santos,IMPR-505,Improve deployment docs,improvement,low,open,2025-01-02 07:35,,2025-01-02 07:35,Asana,
DevOps Dragons,Hannah Kim,FEAT-216,Containerized worker for data processing,feature,low,open,2025-01-04 16:45,,2025-01-04 16:45,GitHub,
Frontend Foxes,Carlos Mendes,IMPR-506,Accessibility improvements in forms,improvement,medium,in_progress,2025-01-05 10:10,,2025-01-06 09:00,Jira,
Alpha Squad,Amina Noor,FEAT-217,Multi-language support,feature,high,open,2025-01-03 13:25,,2025-01-03 13:25,GitHub,
Beta Builders,Elena Rossi,BUG-1053,Memory leak in async worker,bug,high,in_progress,2025-01-02 22:40,,2025-01-05 18:50,Jira,40.2
Data Ninjas,Kai Nakamura,IMPR-507,Schema validation on API responses,improvement,low,open,2025-01-04 06:20,,2025-01-04 06:20,Asana,
Alpha Squad,Alex Rivera,BUG-1024,Fix login timeout after 2 minutes of inactivity,bug,high,open,2025-01-03 09:14,,2025-01-05 11:32,Jira,
Beta Builders,Priya Kapoor,FEAT-208,Add dark mode toggle across settings and dashboards,feature,medium,in_progress,2025-01-04 10:25,,2025-01-07 15:10,GitHub,
Data Ninjas,Liam Chen,IMP-457,Improve logging format for audit trails,improvement,low,open,2025-01-05 08:50,,2025-01-05 08:50,Asana,
Cloud Warriors,Maria Santos,FEAT-209,Integrate S3-compatible storage for backups,feature,high,open,2025-01-06 14:02,,2025-01-06 14:02,Jira,
DevOps Dragons,Noah Patel,BUG-1025,Resolve race condition in deployment pipeline,bug,high,in_progress,2025-01-07 09:40,,2025-01-07 11:00,GitHub,
Frontend Foxes,Emma Rossi,FEAT-210,Create component library for shared UI elements,feature,medium,open,2025-01-08 13:15,,2025-01-08 13:15,Trello,
Alpha Squad,Daniel Kim,IMP-458,Standardize error messages across modules,improvement,low,in_progress,2025-01-03 16:20,,2025-01-06 09:05,Jira,
Beta Builders,Sofia Marin,BUG-1026,Fix frontend rendering glitch on tablet view,bug,medium,open,2025-01-04 18:40,,2025-01-04 18:40,GitHub,
Data Ninjas,Ava Thompson,FEAT-211,Implement data export to CSV with progress indicator,feature,high,in_progress,2025-01-05 12:05,,2025-01-06 10:20,Asana,
Cloud Warriors,Daniela Ruiz,IMP-459,Refactor storage layer interfaces,improvement,low,open,2025-01-06 09:30,,2025-01-06 09:30,GitHub,
DevOps Dragons,Jackson Lee,FEAT-212,Add CI/CD pipeline for automated tests,feature,high,in_progress,2025-01-07 07:55,,2025-01-07 07:55,Jira,
Frontend Foxes,Isabella Nguyen,BUG-1027,Resolve CSS specificity issue in responsive layout,bug,medium,open,2025-01-08 11:20,,2025-01-08 11:20,Trello,
Alpha Squad,Carlos Mendes,FEAT-213,Add multi-language support for core pages,feature,high,open,2025-01-09 09:05,,2025-01-09 09:05,Asana,
Beta Builders,Grace Liu,IMP-460,Improve caching strategy for API responses,improvement,medium,in_progress,2025-01-10 14:25,,2025-01-11 10:40,GitHub,
Data Ninjas,Mason Reed,BUG-1028,Fix intermittent SSL handshake failures,bug,high,open,2025-01-11 08:20,,2025-01-11 08:20,Jira,
Cloud Warriors,Nina Kapoor,FEAT-214,Establish real-time analytics pipeline,feature,high,open,2025-01-12 15:45,,2025-01-12 15:45,GitHub,
DevOps Dragons,Ethan Brown,IMP-461,Consolidate logging configuration format,improvement,low,open,2025-01-13 09:12,,2025-01-13 09:12,Jira,
Frontend Foxes,Maya Singh,FEAT-215,Build responsive grid system for dashboards,feature,medium,open,2025-01-14 13:44,,2025-01-14 13:44,Trello,
Alpha Squad,Priya Sharma,BUG-1029,Fix memory leak in image processing module,bug,high,in_progress,2025-01-04 07:30,,2025-01-06 16:22,GitHub,
Beta Builders,Jonah Park,FEAT-216,Migrate UI to component-driven architecture,feature,high,open,2025-01-05 18:10,,2025-01-05 18:10,Jira,
Data Ninjas,Zoe Kim,IMP-462,Improve error monitoring and alerting,improvement,medium,open,2025-01-06 12:40,,2025-01-06 12:40,Asana,
Cloud Warriors,Olivia Chen,BUG-1030,Address flaky tests in CI suite,bug,low,open,2025-01-07 10:20,,2025-01-07 10:20,GitHub,
Alpha Squad,Liam Carter,FEAT-2041,Implement user profile photo upload with client-side validation,feature,high,in_progress,2025-01-03 09:12,,2025-01-07 16:40,Jira,
Beta Builders,Sophia Patel,BUG-1102,Fix race condition when saving settings concurrently,bug,high,open,2025-01-04 11:25,,2025-01-04 11:25,GitHub,
Data Ninjas,Daniel Kim,IMPR-301,Improve logging format for microservices and add correlation IDs,improvement,medium,open,2025-01-05 08:50,,2025-01-05 08:50,Asana,
Cloud Warriors,Ava Chen,FEAT-208,Add dark mode toggle with persisted user preference,feature,medium,in_progress,2025-01-06 14:02,,2025-01-07 09:17,Jira,
DevOps Dragons,Michael Thompson,BUG-1120,Resolve deployment failure on AWS due to missing IAM policy,bug,high,open,2025-01-05 17:30,,2025-01-05 17:30,GitHub,
Frontend Foxes,Emily Rivera,FEAT-209,Create responsive grid system for dashboard widgets,feature,low,open,2025-01-02 10:15,,2025-01-02 10:15,Trello,
Alpha Squad,Noah Williams,IMPR-612,Refactor CSS variables for theming,improvement,low,closed,2025-01-01 09:05,2025-01-01 12:40,2025-01-01 12:40,Jira,3.58
Beta Builders,Olivia Martinez,FEAT-210,Integrate chat feature with real-time presence,feature,high,in_progress,2025-01-07 10:45,,2025-01-07 10:45,GitHub,
Data Ninjas,Ethan Garcia,BUG-1113,Fix memory leak in data loader for large datasets,bug,medium,open,2025-01-04 16:20,,2025-01-04 16:20,Asana,
Cloud Warriors,Isabella Rossi,IMPR-703,Optimize image processing pipeline for throughput,improvement,medium,open,2025-01-03 08:40,,2025-01-03 08:40,Trello,
DevOps Dragons,James Lee,FEAT-211,Add API rate limiting across services,feature,high,open,2025-01-06 09:15,,2025-01-06 09:15,GitHub,
Frontend Foxes,Grace Kim,BUG-1125,Fix accessibility issue on modal dialog,bug,low,open,2025-01-03 13:05,,2025-01-03 13:05,Jira,
Alpha Squad,Lucas Nguyen,FEAT-212,Support multi-language content rendering,feature,medium,in_progress,2025-01-05 12:30,,2025-01-07 09:02,Asana,
Beta Builders,Mia Patel,IMPR-614,Reduce bundle size with code-splitting,improvement,high,open,2025-01-04 07:20,,2025-01-04 07:20,GitHub,
Data Ninjas,Oliver Chen,BUG-1122,Address flaky test failures in CI pipeline,bug,high,open,2025-01-06 15:05,,2025-01-06 15:05,Jira,
Cloud Warriors,Sophia Wu,FEAT-213,Offline mode support for mobile clients,feature,medium,open,2025-01-07 08:40,,2025-01-07 08:40,Trello,
DevOps Dragons,Daniel Park,IMPR-705,Audit and improve deployment rollback procedures,improvement,low,open,2025-01-02 19:00,,2025-01-02 19:00,Asana,
Frontend Foxes,Hannah Kim,BUG-1128,Fix broken test after refactor of auth module,bug,high,open,2025-01-07 09:30,,2025-01-07 09:30,GitHub,
Alpha Squad,Daniela Garcia,IMPR-616,Improve CI cache strategy,improvement,medium,open,2025-01-04 10:10,,2025-01-04 10:10,Jira,
Beta Builders,Lucas Brown,BUG-1132,Fix flaky UI tests in Cypress,bug,medium,open,2025-01-03 18:45,,2025-01-03 18:45,GitHub,
Data Ninjas,Aria Singh,FEAT-214,Add export to CSV feature for analytics,feature,low,open,2025-01-05 14:50,,2025-01-05 14:50,Asana,
Cloud Warriors,Noah Patel,BUG-1135,Fix memory leak in image lazy-loading,bug,high,open,2025-01-04 22:40,,2025-01-04 22:40,Trello,
Alpha Squad,Alexandra Lee,BUG-1023,Fix null pointer in user profile API when avatar is missing,bug,high,open,2025-01-02 09:15,,2025-01-02 09:20,Jira,
Beta Builders,Daniel Kim,FEAT-208,Add dark mode toggle with persisted preference,feature,medium,in_progress,2025-01-04 11:30,,2025-01-05 16:45,GitHub,
Data Ninjas,Priya Singh,IMP-456,Improve logging format for audit trails,improvement,low,open,2025-01-03 14:05,,2025-01-03 14:15,Asana,
Cloud Warriors,Mateo Alvarez,FEAT-209,Introduce streaming data ingest for metrics,feature,high,open,2025-01-02 08:40,,2025-01-02 08:45,Jira,
DevOps Dragons,Sophie Chen,BUG-1030,Resolve race condition on deployment pipeline,bug,high,in_progress,2025-01-04 09:00,,2025-01-04 12:20,GitHub,
Frontend Foxes,Liam Murphy,IMP-457,Refactor CSS for responsive grid,improvement,medium,open,2025-01-03 10:25,,2025-01-03 10:35,Trello,
Alpha Squad,Chloe Patel,FEAT-210,Implement multi-language support,feature,high,in_progress,2025-01-04 13:50,,2025-01-05 09:40,GitHub,
Beta Builders,Ethan Brown,BUG-1031,Fix UI glitch on modal close animation,bug,medium,open,2025-01-02 17:10,,2025-01-02 17:10,Jira,
Data Ninjas,Aria Patel,FEAT-211,Add offline support for app data,feature,high,open,2025-01-03 09:00,,2025-01-03 09:05,Asana,
Cloud Warriors,Jonas Weber,IMP-458,Optimize query performance for user analytics,improvement,low,open,2025-01-02 12:35,,2025-01-02 12:40,Trello,
DevOps Dragons,Grace Liu,FEAT-212,Migrate to service mesh for internal services,feature,high,in_progress,2025-01-03 15:20,,2025-01-04 08:15,GitHub,
Frontend Foxes,Noah Kim,BUG-1032,Fix broken image rendering on Safari,bug,low,open,2025-01-04 07:45,,2025-01-04 07:50,Jira,
Alpha Squad,Ava Rossi,IMP-459,Update accessibility labels in forms,improvement,medium,open,2025-01-02 21:10,,2025-01-02 21:15,Asana,
Beta Builders,Lucas Martins,FEAT-213,Add cache layer for API responses,feature,high,open,2025-01-03 11:50,,2025-01-03 11:55,GitHub,
Data Ninjas,Kim Wong,BUG-1033,Fix data duplication in sync job,bug,high,in_progress,2025-01-04 16:20,,2025-01-04 18:00,Jira,
Cloud Warriors,Fatima Noor,IMP-460,Improve data retention policy messaging,improvement,low,open,2025-01-02 14:05,,2025-01-02 14:10,Trello,
DevOps Dragons,Oliver Reed,FEAT-214,Add CI/CD pipeline for mobile app,feature,high,open,2025-01-03 18:40,,2025-01-03 18:50,GitHub,
Frontend Foxes,Isabella Rossi,BUG-1034,Address memory leak in frontend state management,bug,high,in_progress,2025-01-04 10:05,,2025-01-04 10:20,Jira,
Alpha Squad,Mason Chen,FEAT-215,Enable push notifications for beta users,feature,medium,open,2025-01-04 19:30,,2025-01-04 19:40,Asana,
Beta Builders,Sophia Diaz,IMP-461,Standardize error handling across services,improvement,low,open,2025-01-02 08:20,,2025-01-02 08:25,Trello,
Alpha Squad,Alex Carter,BUG-1012,Fix login timeout after 15 minutes,bug,high,in_progress,2025-01-02 09:15,,2025-01-03 11:40,Jira,22.75
Beta Builders,Priya Singh,FEAT-208,Add dark mode to user dashboard,feature,medium,open,2025-01-04 14:05,,2025-01-04 14:05,GitHub,
Data Ninjas,Miguel Santos,IMPR-412,Improve API response caching,improvement,low,closed,2025-01-03 08:20,2025-01-05 16:45,2025-01-05 16:45,Jira,56.25
Cloud Warriors,Sara Chen,FEAT-210,Integrate file upload progress indicator,feature,high,in_progress,2025-01-05 10:30,,2025-01-06 09:10,Asana,
DevOps Dragons,Daniel Kim,BUG-1034,Resolve intermittent deployment failure,bug,high,open,2025-01-06 09:00,,2025-01-06 09:00,GitHub,
Frontend Foxes,Emma Rossi,FEAT-211,Refactor header component for accessibility,feature,medium,closed,2025-01-02 12:45,2025-01-04 17:20,2025-01-04 17:20,Jira,54.5
Alpha Squad,Liam Patel,IMPR-415,Reduce bundle size by 15%,improvement,low,closed,2025-01-01 09:00,2025-01-02 18:30,2025-01-02 18:30,Trello,33.5
Beta Builders,Zoë Kim,BUG-1035,Fix flaky unit tests in core module,bug,high,in_progress,2025-01-04 08:15,,2025-01-06 08:15,GitHub,
Data Ninjas,Aarav Sharma,FEAT-212,Launch real-time analytics dashboard,feature,high,open,2025-01-06 13:50,,2025-01-06 13:50,Asana,
Cloud Warriors,Nina Volkov,IMPR-416,Improve error messaging for API failures,improvement,medium,open,2025-01-03 15:25,,2025-01-03 15:25,Jira,
DevOps Dragons,Omar Farouk,FEAT-213,Add multi-env deployment pipeline,feature,medium,closed,2025-01-02 10:40,2025-01-05 09:10,2025-01-05 09:10,GitHub,62.83
Frontend Foxes,Grace Li,BUG-1036,CSS grid gaps causing layout shifts,bug,low,open,2025-01-05 17:20,,2025-01-05 17:20,Trello,
Alpha Squad,Noah Chen,FEAT-214,Offline support in mobile app,feature,high,in_progress,2025-01-05 09:45,,2025-01-06 07:30,Asana,
Beta Builders,Mia Rossi,IMPR-417,Enhance logging for production issues,improvement,medium,open,2025-01-03 11:05,,2025-01-03 11:05,Jira,
Data Ninjas,Chen Wei,BUG-1037,Memory leak in data ingestion service,bug,high,in_progress,2025-01-05 08:10,,2025-01-06 02:40,GitHub,
Cloud Warriors,Priya Nair,FEAT-215,Add export to CSV in reports,feature,low,open,2025-01-06 14:00,,2025-01-06 14:00,Jira,
DevOps Dragons,Sophie Alvarez,BUG-1038,Race condition in service orchestration,bug,high,closed,2025-01-01 16:20,2025-01-03 19:45,2025-01-03 19:45,GitHub,56.42
Frontend Foxes,Victor Hugo,IMPR-418,Improve accessibility for modal dialogs,improvement,low,open,2025-01-04 12:30,,2025-01-04 12:30,Trello,
Alpha Squad,Elena Rossi,BUG-1039,Session timeout not cleared on logout,bug,medium,open,2025-01-02 21:05,,2025-01-06 10:15,GitHub,
Alpha Squad,Jonah Carter,BUG-1023,Fix null pointer in user profile load,bug,high,open,2025-01-03 09:12,,2025-01-03 09:12,Jira,
Beta Builders,Priya Kapoor,FEAT-208,Add dark mode to settings page,feature,medium,in_progress,2025-01-04 11:40,,2025-01-06 16:05,GitHub,
Data Ninjas,Luis Fernández,IMPR-456,Improve pagination performance on data table,improvement,low,open,2025-01-05 14:22,,2025-01-05 14:22,Asana,
Cloud Warriors,Amina El-Sayed,FEAT-212,Implement real-time notification badge,feature,high,open,2025-01-06 09:05,,2025-01-06 09:05,Jira,
DevOps Dragons,Miguel Santos,BUG-1034,Resolve race condition during deploy,bug,high,in_progress,2025-01-03 17:45,,2025-01-06 12:30,GitHub,
Frontend Foxes,Emily Chen,IMPR-499,Refactor CSS for responsive grid,improvement,medium,open,2025-01-02 08:20,,2025-01-02 08:20,Trello,
Alpha Squad,Marta Rossi,FEAT-214,Add multi-language support,feature,high,open,2025-01-07 10:15,,2025-01-07 10:15,GitHub,
Beta Builders,Kai Nakamura,BUG-1035,Fix memory leak in API gateway,bug,high,in_progress,2025-01-04 13:50,,2025-01-06 18:22,Jira,
Data Ninjas,Chen Wei,FEAT-215,Offline mode for data editor,feature,low,open,2025-01-05 09:04,,2025-01-05 09:04,Asana,
Cloud Warriors,Sara Kim,IMPR-501,Cache layer tuning for API calls,improvement,medium,open,2025-01-06 15:30,,2025-01-06 15:30,Trello,
DevOps Dragons,Jon Park,FEAT-216,CI/CD pipeline improvements,feature,medium,open,2025-01-05 12:00,,2025-01-05 12:00,GitHub,
Frontend Foxes,Nina Patel,BUG-1036,Fix alignment issues on mobile header,bug,low,open,2025-01-03 09:55,,2025-01-03 09:55,Jira,
Alpha Squad,Daniela Rossi,IMPR-503,Improve test coverage for auth module,improvement,medium,in_progress,2025-01-04 18:20,,2025-01-06 09:40,Asana,
Beta Builders,Omar Singh,FEAT-217,Add bulk import/export for users,feature,high,open,2025-01-04 08:10,,2025-01-04 08:10,GitHub,
Data Ninjas,Sofia Rossi,BUG-1037,Incorrect data on dashboard widgets,bug,medium,in_progress,2025-01-03 21:40,,2025-01-06 20:10,Jira,
Cloud Warriors,Ahmed Ali,IMPR-504,Improve error handling messages,improvement,low,open,2025-01-05 07:25,,2025-01-05 07:25,Trello,
DevOps Dragons,Lina Fernandez,FEAT-218,Integrate feature flag system,feature,high,open,2025-01-07 11:50,,2025-01-07 11:50,GitHub,
Frontend Foxes,Carlos Mendes,BUG-1038,Resolve CSS variable scoping bug,bug,low,in_progress,2025-01-05 16:45,,2025-01-06 08:50,Jira,
Alpha Squad,Grace Liu,FEAT-219,Accessibility improvements for dialogs,feature,medium,open,2025-01-06 10:10,,2025-01-06 10:10,Asana,
Beta Builders,Aarav Gupta,IMPR-505,Optimize image loading pipeline,improvement,low,open,2025-01-02 14:02,,2025-01-02 14:02,Trello,
Data Ninjas,Elena Petrova,FEAT-220,Offline analytics dashboard,feature,high,open,2025-01-06 09:45,,2025-01-06 09:45,GitHub,
Alpha Squad,Alexandra Reed,FEAT-208,Add dark mode toggle and persistence,feature,high,in_progress,2025-01-02 09:15,,2025-01-07 16:40,Jira,
Beta Builders,Daniel Kim,BUG-101,Fix null pointer in user profile API,bug,high,open,2025-01-03 11:20,,2025-01-03 11:20,GitHub,
Data Ninjas,Priya Singh,IMPR-12,Improve logging format and rotate logs,improvement,medium,in_progress,2025-01-04 14:05,,2025-01-06 10:30,Trello,
Cloud Warriors,Michael Chen,FEAT-231,Implement real-time notifications for deployments,feature,high,open,2025-01-05 09:48,,2025-01-05 09:48,Asana,
DevOps Dragons,Sofia Rossi,BUG-102,Resolve race condition on cache refresh,bug,high,in_progress,2025-01-02 08:30,,2025-01-07 12:05,GitHub,
Frontend Foxes,Liam Carter,IMPR-77,Improve accessibility labels across forms,improvement,medium,open,2025-01-03 10:12,,2025-01-03 10:12,Jira,
Alpha Squad,Maya Patel,BUG-103,Fix image loading timeout on homepage,bug,medium,in_progress,2025-01-04 16:22,,2025-01-06 18:45,GitHub,
Beta Builders,Ethan Zhao,FEAT-210,Add multi-language support for dashboard,feature,low,open,2025-01-02 13:45,,2025-01-02 13:45,Asana,
Data Ninjas,Noor Alvi,FEAT-212,Create data export to CSV with filters,feature,medium,in_progress,2025-01-05 07:30,,2025-01-06 09:20,Jira,
Cloud Warriors,Jonah Park,IMPR-88,Refactor API response shapes for consistency,improvement,low,open,2025-01-01 15:05,,2025-01-01 15:05,Trello,
DevOps Dragons,Ava Thompson,BUG-104,Patch vulnerability in auth flow,bug,high,open,2025-01-06 09:00,,2025-01-06 09:00,GitHub,
Frontend Foxes,Kai Nakamura,FEAT-209,Implement responsive grid for analytics,feature,medium,in_progress,2025-01-03 18:40,,2025-01-06 14:10,Jira,
Alpha Squad,Sophia Martinez,IMPR-23,Enhance error boundaries and user feedback,improvement,low,open,2025-01-02 21:10,,2025-01-02 21:10,Asana,
Beta Builders,Chris Lee,BUG-105,Fix flaky tests in CI pipeline,bug,high,in_progress,2025-01-04 12:00,,2025-01-06 08:25,GitHub,
Data Ninjas,Fatima Noor,IMPR-29,Improve database indexing for reads,improvement,medium,open,2025-01-03 09:25,,2025-01-03 09:25,Trello,
Cloud Warriors,Lucas Fernandez,FEAT-233,Add export to PDF from reports,feature,low,open,2025-01-05 11:50,,2025-01-05 11:50,Asana,
DevOps Dragons,Grace Kim,IMPR-91,Streamline deployment manifests with heredoc,improvement,medium,in_progress,2025-01-02 07:40,,2025-01-07 09:55,Jira,
Frontend Foxes,Owen Murphy,BUG-106,Fix CSS precedence in dashboard widgets,bug,low,open,2025-01-06 10:15,,2025-01-06 10:15,GitHub,
Alpha Squad,Isabella Rossi,FEAT-215,Dashboard widgets draggable reorder,feature,high,in_progress,2025-01-05 08:50,,2025-01-07 11:20,Jira,
Beta Builders,Daniel Park,IMPR-45,Cache warm-up optimizations,improvement,low,open,2025-01-01 17:30,,2025-01-01 17:30,Trello,
Data Ninjas,Ayla Chen,BUG-107,Fix data mismatch in analytics charts,bug,high,open,2025-01-04 19:40,,2025-01-04 19:40,GitHub,
Cloud Warriors,Raj Singh,FEAT-220,Add user role-based dashboards,feature,medium,in_progress,2025-01-03 22:10,,2025-01-07 07:15,Asana,
DevOps Dragons,Chloe Kim,BUG-108,Patch memory leak in worker service,bug,high,open,2025-01-06 13:25,,2025-01-06 13:25,GitHub,
Frontend Foxes,Aiden Clark,IMPR-66,Improve build times with caching,improvement,medium,open,2025-01-02 06:55,,2025-01-02 06:55,Jira,
Alpha Squad,Nora Bennett,BUG-109,Resolve cross-origin issue on assets,bug,high,in_progress,2025-01-04 09:40,,2025-01-07 13:05,GitHub,
Alpha Squad,Alex Johnson,BUG-1023,Fix signup crash when email already exists,bug,high,open,2025-01-03 09:15,,2025-01-03 09:20,Jira,
Beta Builders,Priya Kapoor,FEAT-208,Add dark mode toggle across settings,feature,medium,in_progress,2025-01-04 11:40,,2025-01-07 14:05,GitHub,
Data Ninjas,Carlos Mendes,IMPR-312,Improve logging granularity for API gateway,improvement,low,open,2025-01-05 08:05,,2025-01-05 08:07,Asana,
Cloud Warriors,Mina Zhang,FEAT-214,Introduce user role-based dashboards,feature,high,open,2025-01-02 13:22,,2025-01-02 13:25,GitHub,
DevOps Dragons,Liam O'Sullivan,BUG-1032,Resolve flaky CI pipeline on PR builds,bug,high,in_progress,2025-01-06 16:10,,2025-01-08 10:45,Jira,
Frontend Foxes,Sophie Li,IMPR-458,Refactor CSS to reduce bundle size,improvement,medium,closed,2024-12-28 09:30,2025-01-02 12:00,2025-01-02 12:05,Trello,97.0
Alpha Squad,Daniel Kim,FEAT-219,Add multi-language support for core pages,feature,high,in_progress,2025-01-07 10:50,,2025-01-07 10:52,GitHub,
Beta Builders,Ella Garcia,BUG-1035,Fix translation keys missing in locale files,bug,medium,open,2025-01-03 15:20,,2025-01-03 15:22,Jira,
Data Ninjas,Noah Patel,FEAT-221,Create data export with custom date range,feature,low,open,2025-01-04 09:45,,2025-01-04 09:50,Asana,
Cloud Warriors,Fatima Noor,IMPR-333,Cache frequently accessed data to reduce DB load,improvement,high,in_progress,2025-01-05 12:00,,2025-01-07 09:20,Jira,
DevOps Dragons,Arun Mehta,FEAT-226,Implement SSO across services,feature,high,open,2025-01-02 08:15,,2025-01-02 08:17,GitHub,
Frontend Foxes,Isabella Rossi,BUG-1040,Fix responsive grid break at tablet size,bug,medium,closed,2025-01-01 14:05,2025-01-01 17:30,2025-01-01 17:35,Trello,5.42
Alpha Squad,Grace Chen,IMPR-344,Automate test data generation for CI,improvement,low,open,2025-01-06 09:30,,2025-01-06 09:32,Asana,
Beta Builders,Jonah Kim,FEAT-231,Add offline mode for mobile apps,feature,high,in_progress,2025-01-04 18:40,,2025-01-06 11:10,GitHub,
Data Ninjas,Ava Singh,BUG-1045,Fix API 401 for expired tokens,bug,high,open,2025-01-05 07:15,,2025-01-05 07:18,Jira,
Cloud Warriors,Chen Wei,IMPR-359,Improve database indexing for faster queries,improvement,medium,open,2025-01-07 13:40,,2025-01-07 13:42,Asana,
DevOps Dragons,Zoë Smith,BUG-1048,Resolve intermittent deployment failures on prod,bug,high,open,2025-01-03 07:05,,2025-01-03 07:07,GitHub,
Frontend Foxes,Mason Brooks,FEAT-238,Redesign onboarding flow for new users,feature,medium,closed,2025-01-02 16:45,2025-01-06 09:15,2025-01-06 09:20,Jira,88.5
Alpha Squad,Hannah Lee,BUG-1050,Awkward button alignment on dashboard,bug,low,open,2025-01-08 11:05,,2025-01-08 11:07,GitHub,
Beta Builders,Kai Nakamura,IMPR-370,Accessibility improvements for modal dialogs,improvement,medium,in_progress,2025-01-06 20:20,,2025-01-07 09:10,Asana,
Data Ninjas,Mia Chen,FEAT-245,Integrate analytics events with dashboard,feature,high,open,2025-01-07 08:25,,2025-01-07 08:28,GitHub,
Cloud Warriors,Jon Park,BUG-1053,Fix memory leak in session store,bug,high,open,2025-01-05 10:10,,2025-01-05 10:12,Jira,
DevOps Dragons,Ana Garcia,FEAT-247,Migrate legacy auth to OAuth 2.0,feature,high,open,2025-01-03 09:00,,2025-01-03 09:02,GitHub,
Alpha Squad,Jordan Smith,BUG-1007,Fix null pointer in user profile API,bug,high,open,2025-01-02 09:15,,2025-01-02 09:20,Jira,
Beta Builders,Priya Patel,FEAT-208,Add dark mode theme to settings,feature,medium,in_progress,2025-01-03 11:40,,2025-01-04 14:22,GitHub,
Data Ninjas,Alex Kim,IMPR-321,Improve caching for user list endpoint,improvement,low,open,2025-01-05 08:05,,2025-01-05 08:05,Asana,
Cloud Warriors,Maria Lopez,FEAT-209,Implement export to CSV for reports,feature,medium,open,2025-01-04 16:20,,2025-01-04 16:20,GitHub,
DevOps Dragons,Ethan Chen,BUG-1011,Resolve race condition during deployment,bug,high,in_progress,2025-01-06 10:55,,2025-01-07 09:10,Jira,
Frontend Foxes,Sofia Rossi,IMPR-442,Refactor CSS for mobile responsiveness,improvement,low,open,2025-01-02 13:40,,2025-01-02 13:40,Trello,
Alpha Squad,Daniel Park,FEAT-210,Add multi-language support,feature,high,in_progress,2025-01-03 17:20,,2025-01-06 12:45,GitHub,
Beta Builders,Ana Martinez,BUG-1012,Fix broken pagination on dashboard,bug,medium,open,2025-01-05 09:30,,2025-01-05 09:30,Jira,
Data Ninjas,Noah Williams,FEAT-211,Integrate analytics events,feature,medium,open,2025-01-04 12:15,,2025-01-04 12:15,Asana,
Cloud Warriors,Grace Liu,IMPR-443,Tweak API response sizes,improvement,low,open,2025-01-06 08:40,,2025-01-06 08:40,Trello,
DevOps Dragons,Liam Johnson,FEAT-212,Create CI/CD pipeline for staging,feature,high,in_progress,2025-01-05 15:05,,2025-01-07 10:20,Jira,
Frontend Foxes,Emily Chen,BUG-1013,Address memory leak in image loader,bug,high,open,2025-01-07 09:15,,2025-01-07 09:15,GitHub,
Alpha Squad,Victor Ramos,IMPR-444,Improve log verbosity in prod,improvement,low,open,2025-01-04 07:50,,2025-01-04 07:50,Asana,
Beta Builders,Kimberly Chen,FEAT-213,Add offline support for notes,feature,medium,open,2025-01-05 14:25,,2025-01-05 14:25,GitHub,
Data Ninjas,Oliver Kim,BUG-1014,Fix data inconsistency on report export,bug,high,in_progress,2025-01-06 11:05,,2025-01-06 11:05,Jira,
Cloud Warriors,Hannah Park,FEAT-214,Dashboard: add export to PDF,feature,medium,open,2025-01-04 18:40,,2025-01-04 18:40,GitHub,
