team_name,member_name,task_id,task_title,task_type,priority,status,created_at,closed_at,last_updated,source_tool,cycle_time
Frontend Foxes,Mina Patel,BUG-1032,Fix typo in localization strings,bug,low,open,2025-01-03 08:15,,2025-01-03 08:15,Jira,
Alpha Squad,Chris Martin,IMP-457,Improve error handling strategy across services,improvement,medium,open,2025-01-04 14:30,,2025-01-04 14:30,Asana,
Beta Builders,Zoë Martinez,FEAT-213,Integrate CRM with marketing automation,feature,high,closed,2025-01-02 13:10,2025-01-03 09:50,2025-01-03 09:50,GitHub,25.67
Data Ninjas,Aarav Singh,BUG-1033,Fix memory leak in analytics collector,bug,high,in_progress,2025-01-03 18:40,,2025-01-05 21:02,Jira,
Cloud Warriors,Grace Liu,IMP-503,Consolidate feature flags management,improvement,medium,open,2025-01-06 09:15,,2025-01-06 09:15,Trello,
DevOps Dragons,Sophie Dubois,FEAT-214,Add container orchestration presets,feature,low,open,2025-01-05 15:40,,2025-01-05 15:40,Asana,
Frontend Foxes,Daniel Kim,BUG-1034,Fix responsive bug on mobile header,bug,high,in_progress,2025-01-04 19:50,,2025-01-05 09:15,GitHub,
Alpha Squad,Emma Rossi,FEAT-215,Add audit trail for critical actions,feature,medium,open,2025-01-03 21:05,,2025-01-03 21:05,Jira,
Beta Builders,Noah Williams,IMP-504,Standardize error messages across modules,improvement,low,open,2025-01-04 10:25,,2025-01-04 10:25,Trello,
Data Ninjas,Isha Kapoor,FEAT-216,Offline-first data sync for low-bandwidth areas,feature,high,open,2025-01-05 06:45,,2025-01-05 06:45,GitHub,
Alpha Squad,Alex Morgan,FEAT-207,Add user profile avatars with lazy loading,feature,medium,in_progress,2025-01-03 09:12,,2025-01-04 16:40,GitHub,
Beta Builders,Priya Kapoor,BUG-1048,Fix crash on large image uploads,bug,high,open,2025-01-05 11:22,,2025-01-05 11:22,Jira,
Data Ninjas,Luis Ortega,IMPR-321,Improve error messaging for API rate limits,improvement,low,open,2025-01-02 08:45,,2025-01-04 09:10,Asana,
Cloud Warriors,Emily Chen,FEAT-210,Implement dark mode toggle,feature,medium,in_progress,2025-01-06 14:05,,2025-01-07 10:20,GitHub,
DevOps Dragons,Daniel Kim,BUG-1052,Resolve deployment race condition,bug,high,open,2025-01-04 10:30,,2025-01-04 10:30,Jira,
Frontend Foxes,Sophie Tan,FEAT-208,Add responsive grid system for dashboards,feature,medium,in_progress,2025-01-03 09:05,,2025-01-06 12:00,Trello,
Alpha Squad,Jonah Reed,IMPR-322,Reduce bundle size with code-splitting,improvement,low,open,2025-01-04 15:20,,2025-01-04 15:20,Asana,
Beta Builders,Marta Kowalski,BUG-1049,Fix misalignment in settings panel,bug,medium,closed,2025-01-02 12:40,2025-01-03 09:50,2025-01-03 09:50,GitHub,22.0
Data Ninjas,Noah Patel,FEAT-209,Add multi-language support,feature,high,in_progress,2025-01-05 07:30,,2025-01-06 08:15,Jira,
Cloud Warriors,Ava Singh,IMPR-323,Improve logging granularity,improvement,low,open,2025-01-02 18:00,,2025-01-04 11:00,Trello,
DevOps Dragons,Grace Chen,FEAT-211,CI pipeline enhancements for caching,feature,medium,open,2025-01-03 13:15,,2025-01-03 13:15,Asana,
Frontend Foxes,Carlos Mendes,BUG-1050,Fix flaky tests in UI components,bug,high,in_progress,2025-01-04 09:50,,2025-01-06 09:40,GitHub,
Alpha Squad,Irene Novak,FEAT-212,Offline support for critical dashboards,feature,high,open,2025-01-05 16:40,,2025-01-05 16:40,Jira,
Beta Builders,Tomoko Watanabe,IMPR-324,Accessibility improvements for modals,improvement,medium,open,2025-01-01 10:10,,2025-01-04 07:25,Asana,
Data Ninjas,Hiro Tanaka,BUG-1051,Correct incorrect data due to timezone conversion,bug,high,open,2025-01-03 22:15,,2025-01-05 19:05,GitHub,
Cloud Warriors,Jenna Liu,IMPR-325,Optimize cache invalidation strategy,improvement,low,open,2025-01-02 07:25,,2025-01-04 14:30,Jira,
DevOps Dragons,Victor Rossi,FEAT-213,Real-time deployment status page,feature,high,open,2025-01-06 09:50,,2025-01-06 09:50,GitHub,
Frontend Foxes,Fatima Ali,IMPR-326,UI performance tweaks for lists,improvement,low,open,2025-01-03 08:25,,2025-01-05 12:10,Trello,
Alpha Squad,David Kim,BUG-1053,Memory leak in background worker,bug,high,open,2025-01-04 20:15,,2025-01-05 21:00,Asana,
Beta Builders,Yuki Nakamura,FEAT-214,Add webhook support for events,feature,medium,open,2025-01-05 04:40,,2025-01-05 04:40,GitHub,
Data Ninjas,Emma Rossi,IMPR-327,Automate test data generation for CI,improvement,low,open,2025-01-02 21:50,,2025-01-04 09:30,Jira,
Cloud Warriors,Daniela Ruiz,BUG-1054,Fix intermittent CDN timeout,bug,high,open,2025-01-03 06:55,,2025-01-03 06:55,GitHub,
DevOps Dragons,Peter Chen,IMPR-328,Coordinate on-call rotations,improvement,low,open,2025-01-01 14:20,,2025-01-03 20:00,Asana,
Frontend Foxes,Amina Yusuf,BUG-1055,Fix keyboard navigation in modal dialogs,bug,medium,open,2025-01-03 19:00,,2025-01-04 17:25,GitHub,
Alpha Squad,Lucas Moreau,FEAT-215,Offline data sync for mobile clients,feature,high,open,2025-01-05 12:30,,2025-01-05 12:30,Jira,
Alpha Squad,James Carter,BUG-1012,Fix login crash on Safari,bug,high,in_progress,2025-01-02 10:15,,2025-01-04 14:30,Jira,56.5
Beta Builders,Sophia Patel,FEAT-208,Add dark mode to dashboard,feature,medium,open,2025-01-03 09:40,,2025-01-03 09:40,GitHub,
Data Ninjas,Liam Chen,IMPR-412,Improve API response caching,improvement,low,closed,2025-01-01 11:20,2025-01-02 16:45,2025-01-02 16:45,Asana,30.25
Cloud Warriors,Ava Martinez,FEAT-209,Integrate S3 storage for backups,feature,high,in_progress,2025-01-04 08:10,,2025-01-04 12:22,Jira,
DevOps Dragons,Noah Wilson,BUG-1013,CI pipeline occasionally failing after push,bug,high,open,2025-01-02 14:05,,2025-01-03 09:11,GitHub,
Frontend Foxes,Mia Rossi,IMPR-453,Refactor CSS for responsive grid,improvement,medium,closed,2025-01-01 09:50,2025-01-02 10:40,2025-01-02 10:40,Trello,24.83
Alpha Squad,Oliver Singh,FEAT-210,Implement notifications center,feature,high,open,2025-01-03 16:22,,2025-01-03 16:22,GitHub,
Beta Builders,Emma Johansson,BUG-1014,Fix typo in onboarding screens,bug,low,closed,2025-01-01 12:30,2025-01-01 14:15,2025-01-01 14:15,Jira,1.75
Data Ninjas,Ethan Brown,FEAT-211,Add multi-language support,feature,medium,in_progress,2025-01-02 08:45,,2025-01-04 09:00,Asana,
Cloud Warriors,Isabella Kim,IMPR-414,Optimize image assets for faster load,improvement,low,open,2025-01-01 15:05,,2025-01-01 15:05,GitHub,
DevOps Dragons,Lucas Rivera,FEAT-212,Add feature flags system,feature,medium,in_progress,2025-01-03 07:30,,2025-01-04 07:45,Jira,
Frontend Foxes,Olivia Moore,BUG-1015,Scrollbar rendering glitch on mobile,bug,high,open,2025-01-04 09:15,,2025-01-04 09:15,Trello,
Alpha Squad,Aiden Clark,IMPR-416,Improve error reporting in server logs,improvement,medium,closed,2025-01-01 20:40,2025-01-02 02:10,2025-01-02 02:10,Asana,9.67
Beta Builders,Chloe Liu,FEAT-213,Offline data sync for mobile,feature,high,open,2025-01-02 13:05,,2025-01-04 11:33,GitHub,
Data Ninjas,Benjamin Carter,BUG-1016,Security audit: vulnerable dependency,bug,high,open,2025-01-02 17:00,,2025-01-03 12:20,Jira,
Cloud Warriors,Grace Chen,IMPR-417,Logging improvements for microservices,improvement,low,closed,2025-01-01 10:05,2025-01-01 12:45,2025-01-01 12:45,Jira,2.67
DevOps Dragons,Henry Patel,BUG-1017,Memory leak in worker process,bug,high,open,2025-01-03 19:40,,2025-01-03 19:40,GitHub,
Frontend Foxes,Grace Williams,FEAT-214,Dashboard analytics improvements,feature,medium,in_progress,2025-01-02 09:25,,2025-01-04 08:55,Asana,
Alpha Squad,Daniel Kim,BUG-1018,Session timeout handling bug,bug,high,open,2025-01-04 07:12,,2025-01-04 07:12,GitHub,
Beta Builders,Anna Rossi,IMPR-418,Improve build cache invalidation,improvement,low,open,2025-01-03 21:50,,2025-01-04 09:05,Jira,
Data Ninjas,Sophia Park,FEAT-215,Real-time data dashboard widgets,feature,high,open,2025-01-04 06:30,,2025-01-04 06:30,GitHub,
Cloud Warriors,Daniela Ruiz,BUG-1019,API rate limit handling,bug,medium,in_progress,2025-01-01 13:25,,2025-01-04 12:00,Asana,
Alpha Squad,Ava Patel,BUG-1042,Fix login crash when dual auth is enabled,bug,high,open,2025-01-03 09:14,,2025-01-04 11:28,Jira,
Beta Builders,Priya Kumar,FEAT-2101,Add search autocomplete to project dashboard,feature,medium,in_progress,2025-01-02 14:07,,2025-01-05 16:45,GitHub,
Data Ninjas,Liam Chen,IMPR-512,Improve data export format for CSV reports,improvement,low,open,2025-01-04 08:55,,2025-01-04 08:55,Asana,
Cloud Warriors,Mia Rossi,FEAT-2089,Implement dark mode in user settings,feature,medium,open,2025-01-01 10:20,,2025-01-04 10:30,Jira,
DevOps Dragons,Noah Smith,BUG-1015,Resolve deployment failure on staging,bug,high,closed,2025-01-02 07:45,2025-01-02 12:10,2025-01-02 12:10,GitHub,5.92
Frontend Foxes,Emma Johnson,IMPR-311,Refine UI micro-interactions for buttons,improvement,low,open,2025-01-03 09:00,,2025-01-03 09:00,Trello,
Alpha Squad,Daniel Kim,FEAT-2110,Add multi-language support for core screens,feature,high,in_progress,2025-01-03 11:22,,2025-01-05 09:40,GitHub,
Beta Builders,Sophia Nguyen,BUG-1047,Fix flaky unit tests in CI pipeline,bug,medium,open,2025-01-04 13:15,,2025-01-04 13:15,Jira,
Data Ninjas,Ethan Walker,FEAT-2095,Create analytics dashboard widgets,feature,high,in_progress,2025-01-02 16:40,,2025-01-05 17:20,Asana,
Cloud Warriors,Olivia Brown,IMPR-518,Optimize image loading pipeline,improvement,medium,open,2025-01-04 07:30,,2025-01-04 07:30,Trello,
DevOps Dragons,Lucas Martinez,FEAT-2082,Integrate feature flag system,feature,high,open,2025-01-01 12:15,,2025-01-04 12:15,GitHub,
Frontend Foxes,Isabella Rossi,BUG-1039,Fix CSS grid alignment on 1024px,bug,low,open,2025-01-03 15:05,,2025-01-04 09:40,Jira,
Alpha Squad,Oliver Chen,IMPR-519,Standardize error messages across modules,improvement,medium,closed,2025-01-02 09:18,2025-01-03 18:22,2025-01-03 18:22,Asana,28.0
Beta Builders,Avery Singh,FEAT-2109,Offline mode for data-heavy screens,feature,high,open,2025-01-04 06:40,,2025-01-04 06:40,GitHub,
Data Ninjas,Grace Chen,BUG-1033,Fix memory leak in data processor,bug,high,in_progress,2025-01-02 20:10,,2025-01-05 14:05,Jira,
Cloud Warriors,James Park,IMPR-521,Documentation updates for API surface,improvement,low,open,2025-01-04 09:25,,2025-01-04 09:25,Trello,
DevOps Dragons,Maya Patel,BUG-1019,Fix race condition in deployment pipeline,bug,high,in_progress,2025-01-01 08:50,,2025-01-04 15:10,GitHub,
Frontend Foxes,Henry Lee,FEAT-2111,Improve accessibility for modal dialogs,feature,medium,open,2025-01-03 18:40,,2025-01-03 18:40,Jira,
Alpha Squad,Chloe Park,BUG-1040,Error boundary not catching in route changes,bug,medium,open,2025-01-04 10:05,,2025-01-04 10:05,GitHub,
Beta Builders,Daniel Johnson,IMPR-520,Audit logging verbosity and retention policy,improvement,low,open,2025-01-02 13:40,,2025-01-02 13:40,Asana,
Data Ninjas,Zoe Kim,FEAT-2085,Add data pipeline retry logic,feature,high,open,2025-01-04 01:55,,2025-01-04 01:55,GitHub,
Cloud Warriors,Alex Morales,BUG-1030,Resolve API timeout under peak load,bug,high,in_progress,2025-01-02 22:30,,2025-01-05 12:10,Jira,
Alpha Squad,Daniel Carter,BUG-1023,Fix login crash when token expires,bug,high,in_progress,2025-01-03 10:15,,2025-01-06 14:40,Jira,56.0
Beta Builders,Alicia Nguyen,FEAT-208,Add dark mode toggle for settings,feature,medium,open,2025-01-04 09:30,,2025-01-04 09:30,GitHub,
Data Ninjas,Sanjay Rao,IMPROVE-401,Improve API response caching for user list,improvement,low,open,2025-01-05 11:05,,2025-01-05 11:05,Jira,
Cloud Warriors,Maria Lopez,FEAT-210,Implement caching layer for image assets,feature,high,in_progress,2025-01-02 16:00,,2025-01-06 08:20,GitHub,72.0
DevOps Dragons,Jonah Smith,BUG-1024,Resolve intermittent deployment failure on staging,bug,high,open,2025-01-04 18:45,,2025-01-04 18:45,Asana,
Frontend Foxes,Priya Kapoor,FEAT-211,Responsive grid overhaul for dashboard,feature,medium,closed,2025-01-01 08:20,2025-01-03 12:05,2025-01-03 12:05,GitHub,58.9166666667
Alpha Squad,Liam Chen,IMPROVE-402,Refactor CSS variables for theming,improvement,low,in_progress,2025-01-05 13:40,,2025-01-06 09:10,Jira,
Beta Builders,Emma Patel,BUG-1025,Fix memory leak in user session handler,bug,high,open,2025-01-06 09:20,,2025-01-06 09:20,Jira,
Data Ninjas,Carlos Mendes,FEAT-212,Enable multi-tenant support for workspace,feature,high,in_progress,2025-01-03 14:50,,2025-01-06 10:55,GitHub,62.0
Cloud Warriors,Hana Suzuki,IMPROVE-403,Optimize image CDN delivery,improvement,medium,open,2025-01-02 22:10,,2025-01-02 22:10,Asana,
DevOps Dragons,Noah Kim,FEAT-213,Add real-time notifications for deploys,feature,high,open,2025-01-05 07:25,,2025-01-05 07:25,GitHub,
Frontend Foxes,Isabella Rossi,BUG-1026,Fix layout shift on mobile screens,bug,medium,in_progress,2025-01-05 15:15,,2025-01-06 12:30,Jira,30.5
Alpha Squad,Marco Silveira,FEAT-214,Offline support for data charts,feature,high,open,2025-01-06 10:05,,2025-01-06 10:05,GitHub,
Beta Builders,Grace Lee,IMPROVE-404,Reduce build times with parallel testing,improvement,low,open,2025-01-04 19:40,,2025-01-04 19:40,Trello,
Data Ninjas,Amina Yusuf,BUG-1027,Fix data pagination error in API,bug,high,open,2025-01-03 09:05,,2025-01-03 09:05,Jira,
Cloud Warriors,Victor Chen,FEAT-215,Add exports API for reporting,feature,medium,in_progress,2025-01-02 13:30,,2025-01-06 07:50,GitHub,88.0
DevOps Dragons,Yara Ali,IMPROVE-405,Improve deployment rollback safety checks,improvement,medium,open,2025-01-04 08:10,,2025-01-04 08:10,Asana,
Frontend Foxes,Daniel Kim,BUG-1028,Fix typo in user settings labels,bug,low,closed,2025-01-01 12:45,2025-01-02 09:10,2025-01-02 09:10,Jira,22.4166666667
Alpha Squad,Olivia Martinez,IMPROVE-406,Dark mode preference persistence,improvement,low,open,2025-01-06 06:05,,2025-01-06 06:05,Trello,
Beta Builders,Jason Brown,FEAT-216,Integrate payments with Stripe,feature,high,in_progress,2025-01-02 17:25,,2025-01-06 03:15,GitHub,86.5
Data Ninjas,Nina Patel,BUG-1029,Fix sorting bug in user list,bug,medium,open,2025-01-04 12:50,,2025-01-04 12:50,Jira,
Cloud Warriors,Wei Zhang,IMPROVE-407,Improve TLS configuration checks,improvement,low,open,2025-01-05 18:20,,2025-01-05 18:20,Asana,
DevOps Dragons,Fatima Noor,BUG-1030,Crash on heavy load during scans,bug,high,open,2025-01-03 21:05,,2025-01-03 21:05,GitHub,
Alpha Squad,Alex Turner,BUG-1023,Fix flickering header on dashboard,bug,high,closed,2025-01-02 09:15,2025-01-02 10:02,2025-01-02 10:02,Jira,0.92
Beta Builders,Priya Kapoor,FEAT-208,Add export to CSV for reports,feature,medium,closed,2025-01-03 11:40,2025-01-03 14:10,2025-01-03 14:10,GitHub,162.5
Data Ninjas,Miguel Santos,IMP-456,Improve data indexing for search,improvement,low,open,2025-01-04 08:20,,2025-01-04 08:20,Asana,
Cloud Warriors,Lena Chen,FEAT-209,Implement dark mode across app,feature,high,in_progress,2025-01-05 10:05,,2025-01-05 12:30,Jira,
DevOps Dragons,Omar Farouk,BUG-1024,Migration script fails on Windows agents,bug,high,open,2025-01-05 14:22,,2025-01-05 14:22,GitHub,
Frontend Foxes,Zoë Müller,BUG-1025,UX: button alignment off on mobile,bug,medium,closed,2025-01-06 09:05,2025-01-06 09:45,2025-01-06 09:45,Trello,0.67
Alpha Squad,David Kim,FEAT-210,Integrate payment gateway,feature,high,open,2025-01-07 13:50,,2025-01-07 13:50,Jira,
Beta Builders,Sara Ahmed,IMP-457,Refactor authentication module,improvement,low,in_progress,2025-01-07 09:30,,2025-01-07 11:10,GitHub,
Data Ninjas,Kai Nakamura,FEAT-211,Add data visualization widgets,feature,medium,open,2025-01-08 15:20,,2025-01-08 15:20,Asana,
Cloud Warriors,Amara Singh,BUG-1026,API timeout under heavy load,bug,high,open,2025-01-08 17:40,,2025-01-08 17:40,GitHub,
DevOps Dragons,Jonas Weber,IMP-458,Improve deployment rollback safety,improvement,medium,closed,2025-01-02 12:00,2025-01-02 14:10,2025-01-02 14:10,Jira,120.0
Frontend Foxes,Mia Rossi,FEAT-212,Localization support for EU languages,feature,low,open,2025-01-09 09:45,,2025-01-09 09:45,Trello,
Alpha Squad,Evan Lee,BUG-1027,Memory leak in live preview,bug,high,closed,2025-01-04 18:10,2025-01-04 19:05,2025-01-04 19:05,Asana,55.0
Beta Builders,Alicia Park,FEAT-213,Offline mode for mobile app,feature,medium,open,2025-01-10 08:20,,2025-01-10 08:20,GitHub,
Data Ninjas,Victor Chen,IMP-459,Improve data caching strategy,improvement,low,in_progress,2025-01-10 10:05,,2025-01-10 12:40,Jira,
Cloud Warriors,Riya Kapoor,FEAT-214,Dashboard widgets for metrics,feature,high,open,2025-01-11 11:20,,2025-01-11 11:20,GitHub,
DevOps Dragons,Nadia Rahman,BUG-1028,CI pipeline fails on PR builds,bug,high,open,2025-01-11 14:55,,2025-01-11 14:55,Jira,
Frontend Foxes,Jonah Patel,IMPR-101,Improve accessibility contrast ratios,improvement,low,in_progress,2025-01-12 10:10,,2025-01-12 11:30,Asana,
Alpha Squad,Zara Khan,FEAT-215,Add multi-language support,feature,medium,open,2025-01-13 09:05,,2025-01-13 09:05,Jira,
Alpha Squad,Lucas Alvarez,BUG-1012,Resolve login error affecting OAuth flow for Google accounts,bug,high,in_progress,2025-01-03 09:12,,2025-01-05 16:40,Jira,48.0
Beta Builders,Mia Chen,FEAT-208,Add dark mode toggle and persistence across sessions,feature,medium,open,2025-01-04 11:00,,2025-01-04 11:05,GitHub,
Data Ninjas,Arjun Patel,IMPR-312,Improve data export performance by streaming and batching,improvement,low,open,2025-01-05 14:22,,2025-01-05 14:22,Trello,
Cloud Warriors,Sofia Martins,FEAT-211,Integrate real-time dashboard widgets for latency metrics,feature,high,in_progress,2025-01-02 08:45,,2025-01-06 09:30,Asana,
DevOps Dragons,Jonah Kim,BUG-1045,Fix flaky CI pipeline on Windows build agents,bug,high,open,2025-01-05 09:10,,2025-01-05 09:10,Jira,
Frontend Foxes,Emily Rivera,FEAT-206,Create responsive grid system for product cards,feature,medium,in_progress,2025-01-03 13:40,,2025-01-05 17:25,GitHub,
Alpha Squad,Daniel Kim,IMPR-318,Refactor notification service for better throttling,improvement,low,open,2025-01-06 10:05,,2025-01-06 10:05,Jira,
Beta Builders,Priya Singh,BUG-1020,Correct email delivery failures in the signup workflow,bug,high,in_progress,2025-01-02 16:20,,2025-01-05 22:10,GitHub,40.0
Data Ninjas,Carlos Mendes,FEAT-209,Support multi-language content in user settings,feature,medium,open,2025-01-04 19:45,,2025-01-04 19:45,Asana,
Cloud Warriors,Ava Chen,IMPR-321,Cache frequently accessed data to reduce DB load,improvement,low,open,2025-01-03 07:30,,2025-01-03 07:30,Trello,
DevOps Dragons,Eli Turner,FEAT-212,Add API for bulk user imports,feature,high,open,2025-01-05 12:15,,2025-01-05 12:15,Jira,
Frontend Foxes,Zoey Chen,BUG-1031,Fix CSS grid gap inconsistency on Safari,bug,medium,in_progress,2025-01-02 09:50,,2025-01-05 15:05,GitHub,
Alpha Squad,Nina Petrov,FEAT-207,Add user avatars in comments thread,feature,low,open,2025-01-06 08:25,,2025-01-06 08:25,Asana,
Beta Builders,Lucas Rossi,IMPR-315,Improve error messages for API responses,improvement,low,open,2025-01-04 22:10,,2025-01-04 22:10,Trello,
Data Ninjas,Fatima Noor,BUG-1052,Resolve data alignment issue in analytics charts,bug,high,open,2025-01-01 14:00,,2025-01-04 10:20,GitHub,
Cloud Warriors,Noah Bennett,BUG-1049,Fix intermittent DNS resolution errors in cloud ingress,bug,high,in_progress,2025-01-03 06:15,,2025-01-05 09:50,Jira,
DevOps Dragons,Lila Park,FEAT-213,Support offline mode in mobile app,feature,medium,open,2025-01-02 17:40,,2025-01-04 12:05,GitHub,
Frontend Foxes,Aaron Blake,IMPR-319,Improve accessibility labels for dynamic content,improvement,low,open,2025-01-05 10:50,,2025-01-05 10:50,Trello,
Alpha Squad,Grace Park,BUG-1040,Session timeout not clearing on sign-out,bug,high,in_progress,2025-01-04 15:30,,2025-01-05 18:20,Jira,
Beta Builders,Omar Hassan,FEAT-210,Implement audit logs for critical actions,feature,medium,open,2025-01-03 12:05,,2025-01-03 12:05,GitHub,
Data Ninjas,Yuki Tanaka,IMPR-317,Optimize database indexing for analytics workloads,improvement,medium,open,2025-01-05 19:40,,2025-01-05 19:40,Asana,
Cloud Warriors,Mika Ito,BUG-1043,Fix memory leak in cache layer,bug,high,in_progress,2025-01-02 13:25,,2025-01-05 21:10,GitHub,
DevOps Dragons,Kai Nakamura,IMPR-316,Automate nightly data backup reports,improvement,low,open,2025-01-04 07:50,,2025-01-04 07:50,Trello,
Alpha Squad,Alex Carter,BUG-1023,Fix null pointer in user profile loading,bug,high,in_progress,2025-01-02 09:15,,2025-01-02 12:40,Jira,6.25
Beta Builders,Priya Shah,FEAT-208,Add dark mode toggle for settings,feature,medium,open,2025-01-03 10:05,,2025-01-03 10:20,GitHub,
Data Ninjas,Carlos Mendes,IMPR-467,Improve log aggregation performance,improvement,low,open,2025-01-04 14:30,,2025-01-04 14:35,Asana,
Cloud Warriors,Lina Zhang,FEAT-212,Introduce serverless function for image processing,feature,high,in_progress,2025-01-04 16:45,,2025-01-05 09:10,Jira,
DevOps Dragons,Miguel Alvarez,BUG-1034,CI pipeline fails on Windows runners,bug,high,in_progress,2025-01-02 08:20,,2025-01-05 11:22,GitHub,
Frontend Foxes,Ella Thompson,IMPR-512,Refactor CSS to reduce bundle size,improvement,medium,closed,2025-01-01 09:00,2025-01-02 11:15,2025-01-02 11:15,Trello,26.25
Alpha Squad,Jonah Kim,FEAT-209,Implement multi-tenant support,feature,high,open,2025-01-03 13:50,,2025-01-03 13:50,Jira,
Beta Builders,Nina Patel,BUG-1035,Responsive grid breaks on Safari,bug,medium,in_progress,2025-01-02 15:25,,2025-01-05 08:40,GitHub,
Data Ninjas,Priyanka Singh,FEAT-210,Add export to CSV in analytics page,feature,low,open,2025-01-04 09:40,,2025-01-04 09:40,Asana,
Cloud Warriors,Daniel Park,IMPR-468,Cache headers optimization,improvement,low,open,2025-01-04 18:10,,2025-01-04 18:10,Jira,
DevOps Dragons,Ava Rossi,FEAT-211,Add OAuth login for mobile app,feature,high,in_progress,2025-01-02 12:05,,2025-01-05 09:55,GitHub,
Frontend Foxes,Marco Silva,BUG-1036,Fix alignment issues in dashboard widgets,bug,low,open,2025-01-03 11:30,,2025-01-03 11:45,Trello,
Alpha Squad,Grace Chen,IMPR-469,Improve error messaging across forms,improvement,medium,open,2025-01-05 07:20,,2025-01-05 07:20,Asana,
Beta Builders,Omar Farouk,FEAT-213,Offline support for image gallery,feature,medium,open,2025-01-03 09:10,,2025-01-03 09:10,Jira,
Data Ninjas,Yara Haddad,BUG-1037,Data sync drift in audit log,bug,high,in_progress,2025-01-02 19:40,,2025-01-04 21:30,GitHub,
Cloud Warriors,Samir Khan,IMPR-470,Improve CDN cache hit ratio,improvement,low,open,2025-01-04 21:05,,2025-01-04 21:05,Asana,
DevOps Dragons,Grace Lee,BUG-1038,Docker build hangs on test stage,bug,high,closed,2025-01-01 16:40,2025-01-02 04:50,2025-01-02 04:50,GitHub,33.83
Frontend Foxes,Henry Kim,FEAT-214,Accessibility improvements for modal dialogs,feature,medium,open,2025-01-04 10:22,,2025-01-04 10:22,Jira,
Alpha Squad,Sophie Nguyen,FEAT-215,Add multi-language support,feature,low,open,2025-01-04 14:05,,2025-01-04 14:05,GitHub,
Beta Builders,Kai Chen,IMPR-471,Cleanup deprecations in API layer,improvement,medium,open,2025-01-03 17:45,,2025-01-03 17:45,Asana,
Data Ninjas,Fatima Zahra,BUG-1039,Stale data in analytics cache,bug,high,in_progress,2025-01-02 08:55,,2025-01-05 10:10,GitHub,
Alpha Squad,Daniel Rivera,BUG-1023,Fix null reference in user profile load,bug,high,in_progress,2025-01-03 09:15,,2025-01-07 16:40,Jira,72.0
Beta Builders,Priya Kapoor,FEAT-208,Add dark mode toggle across settings,feature,medium,open,2025-01-05 11:30,,2025-01-05 11:30,GitHub,
Data Ninjas,Liam Chen,IMPR-456,Improve logging format for audit trail,improvement,low,closed,2025-01-02 14:20,2025-01-04 10:50,2025-01-04 10:54,Asana,56.8
Cloud Warriors,Amina Farooq,FEAT-212,Implement multi-tenant data isolation,feature,high,in_progress,2025-01-06 08:45,,2025-01-07 09:20,Jira,
DevOps Dragons,Carlos Mendes,BUG-1050,Resolve deploy failure on staging,bug,high,open,2025-01-04 17:10,,2025-01-06 12:05,GitHub,
Frontend Foxes,Sophia Rossi,FEAT-213,Create responsive grid system,feature,medium,in_progress,2025-01-07 10:00,,2025-01-07 12:45,Trello,
Alpha Squad,Miguel Santos,IMPR-458,Refactor auth middleware for perf,improvement,low,open,2025-01-02 09:40,,2025-01-06 08:30,Jira,
Beta Builders,Ella Thompson,BUG-1025,UI crash on export to CSV,bug,high,closed,2025-01-01 16:20,2025-01-02 10:05,2025-01-02 10:10,GitHub,26.0
Data Ninjas,Noah Patel,FEAT-209,Real-time analytics dashboard widgets,feature,high,in_progress,2025-01-05 13:25,,2025-01-07 14:22,Asana,
Cloud Warriors,Yuki Tan,IMPR-459,Cache invalidation strategy review,improvement,medium,open,2025-01-03 07:55,,2025-01-03 07:55,Jira,
DevOps Dragons,Ravi Kapoor,FEAT-214,Add CI/CD pipeline for feature branches,feature,high,in_progress,2025-01-05 09:15,,2025-01-07 08:40,GitHub,
Frontend Foxes,Isabella Cruz,IMPR-460,Improve accessibility on modal dialogs,improvement,low,open,2025-01-04 12:50,,2025-01-04 12:50,Trello,
Alpha Squad,Grace Kim,FEAT-210,Offline support for core modules,feature,medium,open,2025-01-06 15:05,,2025-01-06 15:05,Asana,
Beta Builders,Jonah Brooks,BUG-1027,Memory leak in background worker,bug,high,open,2025-01-03 20:30,,2025-01-07 09:00,GitHub,
Data Ninjas,Emma Liu,IMPR-461,Cleanup deprecated API routes,improvement,low,closed,2025-01-01 10:20,2025-01-03 14:40,2025-01-03 14:45,Jira,62.0
Cloud Warriors,Jae Park,BUG-1029,Data sync mismatch in replication module,bug,high,open,2025-01-07 06:25,,2025-01-07 06:25,Jira,
DevOps Dragons,Alicia Gómez,FEAT-215,Audit logging for deploys in prod,feature,medium,open,2025-01-02 08:40,,2025-01-04 09:15,GitHub,
Frontend Foxes,Lucas Martins,IMPR-462,Streamline build cache headers,improvement,medium,in_progress,2025-01-04 18:20,,2025-01-06 11:10,Trello,
Alpha Squad,Hannah Lee,BUG-1030,Incorrect error messaging on login,bug,medium,open,2025-01-05 09:00,,2025-01-06 17:45,GitHub,
Beta Builders,Marco Rossi,FEAT-211,Reports module export enhancements,feature,low,open,2025-01-06 13:40,,2025-01-06 13:40,Asana,
Data Ninjas,Chloe Zhang,BUG-1031,Crash when processing large payloads,bug,high,open,2025-01-07 07:25,,2025-01-07 07:25,GitHub,
Cloud Warriors,Mika Ito,FEAT-216,Mobile app push notification channel,feature,medium,open,2025-01-07 12:10,,2025-01-07 12:10,Jira,
Alpha Squad,Jordan Lee,BUG-1023,Fix null pointer in user profile API,bug,high,in_progress,2025-01-03 09:14,,2025-01-04 11:22,Jira,56.0
Beta Builders,Priya Kapoor,FEAT-208,Add two-factor authentication to login,feature,high,open,2025-01-05 10:05,,2025-01-05 10:05,GitHub,
